2025-03-02 14:59:50,805 - Ether / IP / TCP 192.168.88.192:50257 > 157.240.235.15:https PA / Raw
2025-03-02 14:59:50,807 - Ether / IP / UDP / mDNS Qry b'BRWE86F389A94E9.local.'
2025-03-02 14:59:50,818 - Ether / IP / TCP 192.168.88.192:51556 > 71.18.255.144:https PA / Raw
2025-03-02 14:59:50,833 - Ether / IP / TCP 157.240.235.15:https > 192.168.88.192:50257 A / Padding
2025-03-02 14:59:50,844 - Ether / IP / UDP 192.168.88.192:65263 > 74.125.130.95:https / Raw
2025-03-02 14:59:50,846 - Ether / IP / UDP 192.168.88.192:55724 > 172.253.118.95:https / Raw
2025-03-02 14:59:50,849 - Ether / IP / UDP 192.168.88.192:65100 > 74.125.68.139:https / Raw
2025-03-02 14:59:50,850 - Ether / IP / TCP 192.168.88.192:51579 > 71.18.255.144:https S
2025-03-02 14:59:50,855 - Ether / IP / UDP 192.168.88.192:57210 > 172.217.194.102:https / Raw
2025-03-02 14:59:50,866 - Ether / IP / UDP 192.168.88.192:54127 > 8.8.4.4:https / Raw
2025-03-02 14:59:50,867 - Ether / IP / UDP 192.168.88.192:54127 > 8.8.4.4:https / Raw
2025-03-02 14:59:50,868 - Ether / IP / TCP 192.168.88.192:51438 > 27.67.51.59:https A / Raw
2025-03-02 14:59:50,869 - Ether / IP / TCP 192.168.88.192:51438 > 27.67.51.59:https PA / Raw
2025-03-02 14:59:50,869 - Ether / IP / TCP 192.168.88.192:51438 > 27.67.51.59:https PA / Raw
2025-03-02 14:59:50,870 - Ether / IP / TCP 192.168.88.192:51438 > 27.67.51.59:https PA / Raw
2025-03-02 14:59:50,871 - Ether / IP / TCP 192.168.88.192:51435 > 27.67.51.72:https A / Raw
2025-03-02 14:59:50,871 - Ether / IP / TCP 192.168.88.192:51435 > 27.67.51.72:https A / Raw
2025-03-02 14:59:50,872 - Ether / IP / TCP 192.168.88.192:51435 > 27.67.51.72:https PA / Raw
2025-03-02 14:59:50,872 - Ether / IP / TCP 192.168.88.192:51435 > 27.67.51.72:https PA / Raw
2025-03-02 14:59:50,876 - Ether / IP / UDP / mDNS Qry b'LAPTOP-4BK13O0S.local.'
2025-03-02 14:59:50,879 - Ether / IP / UDP / mDNS Ans fe80::fb3a:4802:8036:6521
2025-03-02 14:59:50,880 - Ether / IP / UDP 192.168.88.38:50505 > 224.0.0.252:llmnr / LLMNRQuery who has 'LAPTOP-4BK13O0S.'
2025-03-02 14:59:50,881 - Ether / IP / UDP 172.217.194.102:https > 192.168.88.192:57210 / Raw
2025-03-02 14:59:50,882 - Ether / IP / UDP 172.253.118.95:https > 192.168.88.192:55724 / Raw
2025-03-02 14:59:50,887 - Ether / IP / UDP 74.125.130.95:https > 192.168.88.192:65263 / Raw
2025-03-02 14:59:50,892 - Ether / IP / TCP 27.67.51.72:https > 192.168.88.192:51435 A / Padding
2025-03-02 14:59:50,893 - Ether / IP / TCP 27.67.51.72:https > 192.168.88.192:51435 A / Padding
2025-03-02 14:59:50,894 - Ether / IP / TCP 27.67.51.59:https > 192.168.88.192:51438 A / Padding
2025-03-02 14:59:50,894 - Ether / IP / TCP 27.67.51.59:https > 192.168.88.192:51438 A / Padding
2025-03-02 14:59:50,896 - Ether / IP / TCP 27.67.51.59:https > 192.168.88.192:51438 PA / Raw
2025-03-02 14:59:50,897 - Ether / IP / UDP 192.168.88.192:57210 > 172.217.194.102:https / Raw
2025-03-02 14:59:50,897 - Ether / IP / UDP 192.168.88.192:55724 > 172.253.118.95:https / Raw
2025-03-02 14:59:50,898 - Ether / IP / TCP 27.67.51.59:https > 192.168.88.192:51438 A / Padding
2025-03-02 14:59:50,899 - Ether / IP / TCP 125.234.51.74:https > 192.168.88.192:51447 PA / Raw
2025-03-02 14:59:50,900 - Ether / IP / UDP 192.168.88.192:65263 > 74.125.130.95:https / Raw
2025-03-02 14:59:50,901 - Ether / IP / TCP 125.234.51.74:https > 192.168.88.192:51447 FA / Padding
2025-03-02 14:59:50,902 - Ether / IP / TCP 192.168.88.192:51447 > 125.234.51.74:https FA
2025-03-02 14:59:50,902 - Ether / IP / TCP 192.168.88.192:51447 > 125.234.51.74:https A
2025-03-02 14:59:50,903 - Ether / IP / UDP 8.8.4.4:https > 192.168.88.192:54127 / Raw
2025-03-02 14:59:50,904 - Ether / IP / UDP 8.8.4.4:https > 192.168.88.192:54127 / Raw
2025-03-02 14:59:50,905 - Ether / IP / UDP 8.8.4.4:https > 192.168.88.192:54127 / Raw
2025-03-02 14:59:50,906 - Ether / IP / UDP 8.8.4.4:https > 192.168.88.192:54127 / Raw
2025-03-02 14:59:50,907 - Ether / IP / TCP 125.234.51.74:https > 192.168.88.192:51447 A / Padding
2025-03-02 14:59:50,908 - Ether / IP / TCP 192.168.88.192:51580 > 27.77.82.138:https S
2025-03-02 14:59:50,908 - Ether / IP / TCP 27.77.82.138:https > 192.168.88.192:51580 SA
2025-03-02 14:59:50,912 - Ether / IP / TCP 192.168.88.192:51580 > 27.77.82.138:https A
2025-03-02 14:59:50,914 - Ether / IP / TCP 192.168.88.192:51580 > 27.77.82.138:https A / Raw
2025-03-02 14:59:50,916 - Ether / IP / TCP 192.168.88.192:51580 > 27.77.82.138:https PA / Raw
2025-03-02 14:59:50,917 - Ether / IP / TCP 27.67.51.72:https > 192.168.88.192:51435 PA / Raw
2025-03-02 14:59:50,919 - Ether / IP / UDP 192.168.88.192:54127 > 8.8.4.4:https / Raw
2025-03-02 14:59:50,920 - Ether / IP / UDP 74.125.68.139:https > 192.168.88.192:65100 / Raw
2025-03-02 14:59:50,921 - Ether / IP / TCP 27.77.82.138:https > 192.168.88.192:51580 A / Padding
2025-03-02 14:59:50,922 - Ether / IP / TCP 27.77.82.138:https > 192.168.88.192:51580 A / Padding
2025-03-02 14:59:50,923 - Ether / IP / TCP 27.77.82.138:https > 192.168.88.192:51580 PA / Raw
2025-03-02 14:59:50,924 - Ether / IP / TCP 192.168.88.192:51580 > 27.77.82.138:https PA / Raw
2025-03-02 14:59:50,925 - Ether / IP / TCP 192.168.88.192:51580 > 27.77.82.138:https PA / Raw
2025-03-02 14:59:50,927 - Ether / IP / TCP 192.168.88.192:51580 > 27.77.82.138:https PA / Raw
2025-03-02 14:59:50,928 - Ether / IP / TCP 192.168.88.192:51580 > 27.77.82.138:https A / Raw
2025-03-02 14:59:50,930 - Ether / IP / TCP 192.168.88.192:51580 > 27.77.82.138:https A / Raw
2025-03-02 14:59:50,931 - Ether / IP / TCP 192.168.88.192:51580 > 27.77.82.138:https PA / Raw
2025-03-02 14:59:50,933 - Ether / IP / TCP 27.77.82.138:https > 192.168.88.192:51580 A / Padding
2025-03-02 14:59:50,934 - Ether / IP / TCP 27.77.82.138:https > 192.168.88.192:51580 A / Padding
2025-03-02 14:59:50,935 - Ether / IP / TCP 27.77.82.138:https > 192.168.88.192:51580 A / Padding
2025-03-02 14:59:50,937 - Ether / IP / TCP 27.77.82.138:https > 192.168.88.192:51580 A / Padding
2025-03-02 14:59:50,938 - Ether / IP / TCP 27.77.82.138:https > 192.168.88.192:51580 A / Padding
2025-03-02 14:59:50,939 - Ether / IP / TCP 27.77.82.138:https > 192.168.88.192:51580 PA / Raw
2025-03-02 14:59:50,939 - Ether / IP / UDP 192.168.88.192:65100 > 74.125.68.139:https / Raw
2025-03-02 14:59:50,941 - Ether / IP / TCP 27.77.82.138:https > 192.168.88.192:51580 PA / Raw
2025-03-02 14:59:50,941 - Ether / IP / TCP 192.168.88.192:51580 > 27.77.82.138:https A
2025-03-02 14:59:50,943 - Ether / IP / TCP 192.168.88.192:51580 > 27.77.82.138:https PA / Raw
2025-03-02 14:59:50,944 - Ether / IP / TCP 27.77.82.138:https > 192.168.88.192:51580 PA / Raw
2025-03-02 14:59:50,945 - Ether / IP / TCP 192.168.88.192:51438 > 27.67.51.59:https A
2025-03-02 14:59:50,946 - Ether / IP / UDP 8.8.4.4:https > 192.168.88.192:54127 / Raw
2025-03-02 14:59:50,958 - Ether / IP / TCP 192.168.88.192:51435 > 27.67.51.72:https A
2025-03-02 14:59:50,970 - Ether / IP / TCP 27.77.82.138:https > 192.168.88.192:51580 A / Padding
2025-03-02 14:59:50,977 - Ether / IP / TCP 192.168.88.192:51580 > 27.77.82.138:https A
2025-03-02 14:59:50,979 - Ether / IP / TCP 27.77.82.138:https > 192.168.88.192:51580 PA / Raw
2025-03-02 14:59:50,986 - Ether / IP / TCP 27.77.82.138:https > 192.168.88.192:51580 PA / Raw
2025-03-02 14:59:50,987 - Ether / IP / TCP 192.168.88.192:51580 > 27.77.82.138:https A
2025-03-02 14:59:50,988 - Ether / IP / TCP 157.240.235.15:https > 192.168.88.192:50257 PA / Raw
2025-03-02 14:59:50,989 - Ether / IP / TCP 27.67.51.59:https > 192.168.88.192:51438 PA / Raw
2025-03-02 14:59:50,993 - Ether / IP / TCP 27.67.51.59:https > 192.168.88.192:51438 PA / Raw
2025-03-02 14:59:50,994 - Ether / IP / TCP 192.168.88.192:51438 > 27.67.51.59:https A
2025-03-02 14:59:50,995 - Ether / IP / TCP 192.168.88.192:51438 > 27.67.51.59:https PA / Raw
2025-03-02 14:59:51,001 - Ether / IP / UDP 74.125.68.139:https > 192.168.88.192:65100 / Raw
2025-03-02 14:59:51,003 - Ether / IP / UDP 192.168.88.192:54127 > 8.8.4.4:https / Raw
2025-03-02 14:59:51,004 - Ether / IP / UDP 192.168.88.192:54127 > 8.8.4.4:https / Raw
2025-03-02 14:59:51,005 - Ether / IP / TCP 192.168.88.192:51438 > 27.67.51.59:https A / Raw
2025-03-02 14:59:51,007 - Ether / IP / TCP 192.168.88.192:51438 > 27.67.51.59:https PA / Raw
2025-03-02 14:59:51,008 - Ether / IP / TCP 192.168.88.192:51438 > 27.67.51.59:https PA / Raw
2025-03-02 14:59:51,017 - Ether / IP / TCP 27.67.51.59:https > 192.168.88.192:51438 A / Padding
2025-03-02 14:59:51,027 - Ether / IP / TCP 27.67.51.59:https > 192.168.88.192:51438 A / Padding
2025-03-02 14:59:51,028 - Ether / IP / TCP 27.67.51.59:https > 192.168.88.192:51438 A / Padding
2025-03-02 14:59:51,029 - Ether / IP / TCP 27.67.51.59:https > 192.168.88.192:51438 A / Padding
2025-03-02 14:59:51,036 - Ether / IP / UDP 8.8.4.4:https > 192.168.88.192:54127 / Raw
2025-03-02 14:59:51,037 - Ether / IP / UDP 8.8.4.4:https > 192.168.88.192:54127 / Raw
2025-03-02 14:59:51,038 - Ether / IP / TCP 192.168.88.192:50257 > 157.240.235.15:https A
2025-03-02 14:59:51,038 - Ether / IP / UDP 8.8.4.4:https > 192.168.88.192:54127 / Raw
2025-03-02 14:59:51,039 - Ether / IP / UDP 8.8.4.4:https > 192.168.88.192:54127 / Raw
2025-03-02 14:59:51,043 - Ether / IP / UDP 172.253.118.95:https > 192.168.88.192:55724 / Raw
2025-03-02 14:59:51,044 - Ether / IP / UDP 192.168.88.192:54127 > 8.8.4.4:https / Raw
2025-03-02 14:59:51,046 - Ether / IP / UDP 172.253.118.95:https > 192.168.88.192:55724 / Raw
2025-03-02 14:59:51,050 - Ether / IP / UDP 74.125.130.95:https > 192.168.88.192:65263 / Raw
2025-03-02 14:59:51,051 - Ether / IP / UDP 74.125.130.95:https > 192.168.88.192:65263 / Raw
2025-03-02 14:59:51,052 - Ether / IP / TCP 71.18.255.144:https > 192.168.88.192:51556 A / Padding
2025-03-02 14:59:51,054 - Ether / IP / UDP 192.168.88.192:55724 > 172.253.118.95:https / Raw
2025-03-02 14:59:51,061 - Ether / IP / UDP 172.217.194.102:https > 192.168.88.192:57210 / Raw
2025-03-02 14:59:51,063 - Ether / IP / UDP 192.168.88.192:65263 > 74.125.130.95:https / Raw
2025-03-02 14:59:51,066 - Ether / IP / TCP 71.18.255.144:https > 192.168.88.192:51556 PA / Raw
2025-03-02 14:59:51,067 - Ether / IP / TCP 71.18.255.144:https > 192.168.88.192:51556 PA / Raw
2025-03-02 14:59:51,068 - Ether / IP / TCP 192.168.88.192:51556 > 71.18.255.144:https A
2025-03-02 14:59:51,069 - Ether / IP / TCP 192.168.88.192:51556 > 71.18.255.144:https FA
2025-03-02 14:59:51,070 - Ether / IP / UDP 192.168.88.192:57210 > 172.217.194.102:https / Raw
2025-03-02 14:59:51,071 - Ether / IP / TCP 71.18.255.144:https > 192.168.88.192:51556 FA / Padding
2025-03-02 14:59:51,071 - Ether / IP / TCP 192.168.88.192:51556 > 71.18.255.144:https A
2025-03-02 14:59:51,082 - Ether / IP / UDP 8.8.4.4:https > 192.168.88.192:54127 / Raw
2025-03-02 14:59:51,086 - Ether / IP / TCP 71.18.255.144:https > 192.168.88.192:51579 SA
2025-03-02 14:59:51,087 - Ether / IP / TCP 192.168.88.192:51579 > 71.18.255.144:https A
2025-03-02 14:59:51,088 - Ether / IP / TCP 192.168.88.192:51579 > 71.18.255.144:https A / Raw
2025-03-02 14:59:51,089 - Ether / IP / TCP 192.168.88.192:51579 > 71.18.255.144:https PA / Raw
2025-03-02 14:59:51,090 - Ether / IP / UDP 172.253.118.95:https > 192.168.88.192:55724 / Raw
2025-03-02 14:59:51,098 - Ether / IP / UDP 172.217.194.102:https > 192.168.88.192:57210 / Raw
2025-03-02 14:59:51,104 - Ether / IP / UDP 74.125.130.95:https > 192.168.88.192:65263 / Raw
2025-03-02 14:59:51,105 - Ether / IP / TCP 27.67.51.72:https > 192.168.88.192:51435 PA / Raw
2025-03-02 14:59:51,108 - Ether / IP / TCP 27.67.51.72:https > 192.168.88.192:51435 A / Raw
2025-03-02 14:59:51,109 - Ether / IP / TCP 192.168.88.192:51435 > 27.67.51.72:https A
2025-03-02 14:59:51,110 - Ether / IP / TCP 27.67.51.72:https > 192.168.88.192:51435 PA / Raw
2025-03-02 14:59:51,111 - Ether / IP / TCP 27.67.51.72:https > 192.168.88.192:51435 A / Raw
2025-03-02 14:59:51,111 - Ether / IP / TCP 27.67.51.72:https > 192.168.88.192:51435 PA / Raw
2025-03-02 14:59:51,112 - Ether / IP / TCP 192.168.88.192:51435 > 27.67.51.72:https A
2025-03-02 14:59:51,113 - Ether / IP / TCP 192.168.88.192:51435 > 27.67.51.72:https PA / Raw
2025-03-02 14:59:51,117 - Ether / IP / TCP 27.67.51.59:https > 192.168.88.192:51438 PA / Raw
2025-03-02 14:59:51,118 - Ether / IP / TCP 27.67.51.59:https > 192.168.88.192:51438 PA / Raw
2025-03-02 14:59:51,119 - Ether / IP / TCP 192.168.88.192:51438 > 27.67.51.59:https A
2025-03-02 14:59:51,120 - Ether / IP / UDP 192.168.88.192:54127 > 8.8.4.4:https / Raw
2025-03-02 14:59:51,121 - Ether / IP / UDP 192.168.88.192:54127 > 8.8.4.4:https / Raw
2025-03-02 14:59:51,126 - Ether / IP / TCP 192.168.88.192:51438 > 27.67.51.59:https A / Raw
2025-03-02 14:59:51,127 - Ether / IP / TCP 192.168.88.192:51438 > 27.67.51.59:https PA / Raw
2025-03-02 14:59:51,128 - Ether / IP / TCP 192.168.88.192:51438 > 27.67.51.59:https PA / Raw
2025-03-02 14:59:51,132 - Ether / IP / TCP 27.67.51.72:https > 192.168.88.192:51435 A / Padding
2025-03-02 14:59:51,150 - Ether / IP / UDP 8.8.4.4:https > 192.168.88.192:54127 / Raw
2025-03-02 14:59:51,151 - Ether / IP / UDP 8.8.4.4:https > 192.168.88.192:54127 / Raw
2025-03-02 14:59:51,152 - Ether / IP / TCP 27.67.51.59:https > 192.168.88.192:51438 A / Padding
2025-03-02 14:59:51,154 - Ether / IP / TCP 27.67.51.59:https > 192.168.88.192:51438 A / Padding
2025-03-02 14:59:51,156 - Ether / IP / UDP 8.8.4.4:https > 192.168.88.192:54127 / Raw
2025-03-02 14:59:51,156 - Ether / IP / UDP 8.8.4.4:https > 192.168.88.192:54127 / Raw
2025-03-02 14:59:51,157 - Ether / IP / TCP 192.168.88.192:51581 > 125.234.51.50:https S
2025-03-02 14:59:51,162 - Ether / IP / TCP 125.234.51.50:https > 192.168.88.192:51581 SA
2025-03-02 14:59:51,163 - Ether / IP / TCP 192.168.88.192:51581 > 125.234.51.50:https A
2025-03-02 14:59:51,164 - Ether / IP / TCP 192.168.88.192:51581 > 125.234.51.50:https A / Raw
2025-03-02 14:59:51,164 - Ether / IP / TCP 192.168.88.192:51581 > 125.234.51.50:https PA / Raw
2025-03-02 14:59:51,165 - Ether / IP / UDP 192.168.88.192:54127 > 8.8.4.4:https / Raw
2025-03-02 14:59:51,170 - Ether / IP / TCP 125.234.51.50:https > 192.168.88.192:51581 PA / Raw
2025-03-02 14:59:51,171 - Ether / IP / TCP 192.168.88.192:51581 > 125.234.51.50:https PA / Raw
2025-03-02 14:59:51,172 - Ether / IP / TCP 192.168.88.192:51581 > 125.234.51.50:https PA / Raw
2025-03-02 14:59:51,172 - Ether / IP / TCP 192.168.88.192:51581 > 125.234.51.50:https PA / Raw
2025-03-02 14:59:51,175 - Ether / IP / TCP 125.234.51.50:https > 192.168.88.192:51581 A / Padding
2025-03-02 14:59:51,176 - Ether / IP / TCP 125.234.51.50:https > 192.168.88.192:51581 A / Padding
2025-03-02 14:59:51,177 - Ether / IP / TCP 125.234.51.50:https > 192.168.88.192:51581 A / Padding
2025-03-02 14:59:51,178 - Ether / IP / TCP 125.234.51.50:https > 192.168.88.192:51581 PA / Raw
2025-03-02 14:59:51,181 - Ether / IP / TCP 125.234.51.50:https > 192.168.88.192:51581 PA / Raw
2025-03-02 14:59:51,182 - Ether / IP / TCP 192.168.88.192:51581 > 125.234.51.50:https A
2025-03-02 14:59:51,182 - Ether / IP / TCP 192.168.88.192:51581 > 125.234.51.50:https PA / Raw
2025-03-02 14:59:51,183 - Ether / IP / TCP 125.234.51.50:https > 192.168.88.192:51581 PA / Raw
2025-03-02 14:59:51,190 - Ether / IP / TCP 125.234.51.50:https > 192.168.88.192:51581 PA / Raw
2025-03-02 14:59:51,191 - Ether / IP / TCP 192.168.88.192:51581 > 125.234.51.50:https A
2025-03-02 14:59:51,192 - Ether / IP / TCP 125.234.51.50:https > 192.168.88.192:51581 PA / Raw
2025-03-02 14:59:51,193 - Ether / IP / TCP 125.234.51.50:https > 192.168.88.192:51581 A / Raw
2025-03-02 14:59:51,194 - Ether / IP / TCP 125.234.51.50:https > 192.168.88.192:51581 A / Raw
2025-03-02 14:59:51,194 - Ether / IP / TCP 192.168.88.192:51581 > 125.234.51.50:https A
2025-03-02 14:59:51,195 - Ether / IP / TCP 125.234.51.50:https > 192.168.88.192:51581 PA / Raw
2025-03-02 14:59:51,195 - Ether / IP / TCP 192.168.88.192:51581 > 125.234.51.50:https A
2025-03-02 14:59:51,203 - Ether / IP / UDP 8.8.4.4:https > 192.168.88.192:54127 / Raw
2025-03-02 14:59:51,204 - Ether / IP / UDP 192.168.88.192:65100 > 74.125.68.139:https / Raw
2025-03-02 14:59:51,208 - Ether / IP / TCP 192.168.88.192:50278 > 192.168.88.149:8009 PA / Raw
2025-03-02 14:59:51,254 - Ether / IP / TCP 27.67.51.59:https > 192.168.88.192:51438 PA / Raw
2025-03-02 14:59:51,258 - Ether / IP / TCP 27.67.51.59:https > 192.168.88.192:51438 PA / Raw
2025-03-02 14:59:51,259 - Ether / IP / TCP 192.168.88.192:51438 > 27.67.51.59:https A
2025-03-02 14:59:51,263 - Ether / IP / UDP / mDNS Qry b'_companion-link._tcp.local.'
2025-03-02 14:59:51,279 - Ether / IP / UDP 74.125.68.139:https > 192.168.88.192:65100 / Raw
2025-03-02 14:59:51,307 - Ether / IP / TCP 71.18.255.144:https > 192.168.88.192:51556 A / Padding
2025-03-02 14:59:51,308 - Ether / IP / TCP 192.168.88.149:8009 > 192.168.88.192:50278 PA / Raw
2025-03-02 14:59:51,342 - Ether / IP / TCP 71.18.255.144:https > 192.168.88.192:51579 A / Padding
2025-03-02 14:59:51,343 - Ether / IP / TCP 71.18.255.144:https > 192.168.88.192:51579 A / Padding
2025-03-02 14:59:51,343 - Ether / IP / TCP 71.18.255.144:https > 192.168.88.192:51579 PA / Raw
2025-03-02 14:59:51,344 - Ether / IP / TCP 192.168.88.192:51579 > 71.18.255.144:https PA / Raw
2025-03-02 14:59:51,344 - Ether / IP / TCP 192.168.88.192:51579 > 71.18.255.144:https A / Raw
2025-03-02 14:59:51,345 - Ether / IP / TCP 192.168.88.192:51579 > 71.18.255.144:https A / Raw
2025-03-02 14:59:51,345 - Ether / IP / TCP 192.168.88.192:51579 > 71.18.255.144:https PA / Raw
2025-03-02 14:59:51,363 - Ether / IP / TCP 192.168.88.192:50278 > 192.168.88.149:8009 A
2025-03-02 14:59:51,369 - Ether / IP / UDP / DNS Qry b'mobile.events.data.microsoft.com.'
2025-03-02 14:59:51,405 - Ether / IP / UDP / DNS Ans b'mobile.events.data.trafficmanager.net.'
2025-03-02 14:59:51,406 - Ether / IP / TCP 192.168.88.192:51582 > 20.189.173.8:https S
2025-03-02 14:59:51,487 - Ether / IP / UDP 192.168.88.192:65100 > 74.125.68.139:https / Raw
2025-03-02 14:59:51,535 - Ether / IP / TCP 192.168.88.192:51519 > 20.189.173.5:https PA / Raw
2025-03-02 14:59:51,536 - Ether / IP / TCP 192.168.88.192:51519 > 20.189.173.5:https A / Raw
2025-03-02 14:59:51,537 - Ether / IP / TCP 192.168.88.192:51519 > 20.189.173.5:https A / Raw
2025-03-02 14:59:51,537 - Ether / IP / TCP 192.168.88.192:51519 > 20.189.173.5:https PA / Raw
2025-03-02 14:59:51,564 - Ether / IP / UDP 74.125.68.139:https > 192.168.88.192:65100 / Raw
2025-03-02 14:59:51,588 - Ether / IP / TCP 71.18.255.144:https > 192.168.88.192:51579 A / Padding
2025-03-02 14:59:51,589 - Ether / IP / TCP 71.18.255.144:https > 192.168.88.192:51579 A / Padding
2025-03-02 14:59:51,593 - Ether / IP / TCP 20.189.173.8:https > 192.168.88.192:51582 SA
2025-03-02 14:59:51,594 - Ether / IP / TCP 192.168.88.192:51582 > 20.189.173.8:https A
2025-03-02 14:59:51,595 - Ether / IP / TCP 192.168.88.192:51582 > 20.189.173.8:https PA / Raw
2025-03-02 14:59:51,599 - Ether / IP / TCP 71.18.255.144:https > 192.168.88.192:51579 PA / Raw
2025-03-02 14:59:51,640 - Ether / IP / TCP 192.168.88.192:51579 > 71.18.255.144:https A
2025-03-02 14:59:51,727 - Ether / IP / TCP 20.189.173.5:https > 192.168.88.192:51519 A / Padding
2025-03-02 14:59:51,730 - Ether / IP / TCP 20.189.173.5:https > 192.168.88.192:51519 A / Padding
2025-03-02 14:59:51,734 - Ether / IP / TCP 20.189.173.5:https > 192.168.88.192:51519 PA / Raw
2025-03-02 14:59:51,780 - Ether / IP / TCP 192.168.88.192:51519 > 20.189.173.5:https A
2025-03-02 14:59:51,781 - Ether / IP / UDP 192.168.88.192:65100 > 74.125.68.139:https / Raw
2025-03-02 14:59:51,784 - Ether / IP / TCP 20.189.173.8:https > 192.168.88.192:51582 PA / Raw
2025-03-02 14:59:51,785 - Ether / IP / TCP 192.168.88.192:51582 > 20.189.173.8:https PA / Raw
2025-03-02 14:59:51,888 - Ether / IP / UDP 192.168.88.192:65100 > 74.125.68.139:https / Raw
2025-03-02 14:59:51,901 - Ether / IP / UDP / mDNS Qry b'_companion-link._tcp.local.'
2025-03-02 14:59:51,949 - Ether / IP / UDP 74.125.68.139:https > 192.168.88.192:65100 / Raw
2025-03-02 14:59:51,961 - Ether / ARP who has 192.168.88.134 says 192.168.88.134 / Padding
2025-03-02 14:59:51,982 - Ether / IP / TCP 20.189.173.8:https > 192.168.88.192:51582 A / Raw
2025-03-02 14:59:51,983 - Ether / IP / TCP 20.189.173.8:https > 192.168.88.192:51582 A / Raw
2025-03-02 14:59:51,983 - Ether / IP / TCP 192.168.88.192:51582 > 20.189.173.8:https A
2025-03-02 14:59:51,984 - Ether / IP / TCP 20.189.173.8:https > 192.168.88.192:51582 A / Raw
2025-03-02 14:59:51,985 - Ether / IP / TCP 20.189.173.8:https > 192.168.88.192:51582 PA / Raw
2025-03-02 14:59:51,985 - Ether / IP / TCP 192.168.88.192:51582 > 20.189.173.8:https A
2025-03-02 14:59:51,986 - Ether / IP / TCP 192.168.88.192:51582 > 20.189.173.8:https A / Raw
2025-03-02 14:59:51,987 - Ether / IP / TCP 192.168.88.192:51582 > 20.189.173.8:https A / Raw
2025-03-02 14:59:51,987 - Ether / IP / TCP 192.168.88.192:51582 > 20.189.173.8:https A / Raw
2025-03-02 14:59:51,988 - Ether / IP / TCP 192.168.88.192:51582 > 20.189.173.8:https A / Raw
2025-03-02 14:59:51,989 - Ether / IP / TCP 192.168.88.192:51582 > 20.189.173.8:https PA / Raw
2025-03-02 14:59:52,151 - Ether / IP / UDP 192.168.88.192:65100 > 74.125.68.139:https / Raw
2025-03-02 14:59:52,177 - Ether / IP / TCP 20.189.173.8:https > 192.168.88.192:51582 A / Padding
2025-03-02 14:59:52,178 - Ether / IP / TCP 20.189.173.8:https > 192.168.88.192:51582 A / Padding
2025-03-02 14:59:52,178 - Ether / IP / TCP 20.189.173.8:https > 192.168.88.192:51582 PA / Raw
2025-03-02 14:59:52,181 - Ether / IP / TCP 20.189.173.8:https > 192.168.88.192:51582 FPA / Raw
2025-03-02 14:59:52,181 - Ether / IP / TCP 192.168.88.192:51582 > 20.189.173.8:https A
2025-03-02 14:59:52,182 - Ether / IP / TCP 192.168.88.192:51582 > 20.189.173.8:https PA / Raw
2025-03-02 14:59:52,182 - Ether / IP / TCP 192.168.88.192:51582 > 20.189.173.8:https FA
2025-03-02 14:59:52,192 - Ether / IP / UDP / mDNS Qry b'BRWE86F389A94E9.local.'
2025-03-02 14:59:52,193 - Ether / IP / UDP 192.168.88.139:63691 > 224.0.0.252:llmnr / LLMNRQuery who has 'BRWE86F389A94E9.'
2025-03-02 14:59:52,210 - Ether / IP / UDP 74.125.68.139:https > 192.168.88.192:65100 / Raw
2025-03-02 14:59:52,368 - Ether / IP / TCP 20.189.173.8:https > 192.168.88.192:51582 A / Padding
2025-03-02 14:59:52,375 - Ether / IP / UDP 74.125.68.139:https > 192.168.88.192:65100 / Raw
2025-03-02 14:59:52,375 - Ether / IP / UDP 192.168.88.192:65100 > 74.125.68.139:https / Raw
2025-03-02 14:59:52,416 - Ether / IP / UDP 192.168.88.192:65100 > 74.125.68.139:https / Raw
2025-03-02 14:59:52,490 - Ether / IP / UDP 74.125.68.139:https > 192.168.88.192:65100 / Raw
2025-03-02 14:59:52,611 - Ether / IP / UDP 192.168.88.139:63691 > 224.0.0.252:llmnr / LLMNRQuery who has 'BRWE86F389A94E9.'
2025-03-02 14:59:52,694 - Ether / IP / UDP 192.168.88.192:65100 > 74.125.68.139:https / Raw
2025-03-02 14:59:52,769 - Ether / IP / UDP 74.125.68.139:https > 192.168.88.192:65100 / Raw
2025-03-02 14:59:52,976 - Ether / IP / UDP 192.168.88.192:65100 > 74.125.68.139:https / Raw
2025-03-02 14:59:53,051 - Ether / IP / UDP 74.125.68.139:https > 192.168.88.192:65100 / Raw
2025-03-02 14:59:53,200 - Ether / IP / UDP / mDNS Qry b'BRWE86F389A94E9.local.'
2025-03-02 14:59:53,254 - Ether / IP / UDP 192.168.88.192:65100 > 74.125.68.139:https / Raw
2025-03-02 14:59:53,299 - Ether / IP / UDP 192.168.88.192:49383 > 239.255.255.250:ssdp / Raw
2025-03-02 14:59:53,303 - Ether / IP / UDP 169.254.122.97:ssdp > 192.168.88.192:49383 / Raw
2025-03-02 14:59:53,329 - Ether / IP / UDP 74.125.68.139:https > 192.168.88.192:65100 / Raw
2025-03-02 14:59:53,373 - Ether / IP / TCP 104.22.37.195:https > 192.168.88.192:50237 PA / Raw
2025-03-02 14:59:53,374 - Ether / IP / TCP 104.22.37.195:https > 192.168.88.192:50237 PA / Raw
2025-03-02 14:59:53,375 - Ether / IP / TCP 192.168.88.192:50237 > 104.22.37.195:https A
2025-03-02 14:59:53,376 - Ether / IP / TCP 192.168.88.192:50237 > 104.22.37.195:https PA / Raw
2025-03-02 14:59:53,377 - Ether / IP / TCP 192.168.88.192:50237 > 104.22.37.195:https PA / Raw
2025-03-02 14:59:53,384 - Ether / IP / TCP 192.168.88.192:50237 > 104.22.37.195:https PA / Raw
2025-03-02 14:59:53,411 - Ether / IP / TCP 104.22.37.195:https > 192.168.88.192:50237 A / Padding
2025-03-02 14:59:53,412 - Ether / IP / TCP 104.22.37.195:https > 192.168.88.192:50237 A / Padding
2025-03-02 14:59:53,423 - Ether / IP / TCP 104.22.37.195:https > 192.168.88.192:50237 A / Padding
2025-03-02 14:59:53,534 - Ether / IP / UDP 192.168.88.192:65100 > 74.125.68.139:https / Raw
2025-03-02 14:59:53,583 - Ether / IP / TCP 192.168.88.192:50404 > 204.79.197.239:https PA / Raw
2025-03-02 14:59:53,583 - Ether / IP / TCP 192.168.88.192:50404 > 204.79.197.239:https PA / Raw
2025-03-02 14:59:53,584 - Ether / IP / TCP 192.168.88.192:50404 > 204.79.197.239:https PA / Raw
2025-03-02 14:59:53,609 - Ether / IP / UDP 74.125.68.139:https > 192.168.88.192:65100 / Raw
2025-03-02 14:59:53,621 - Ether / IP / TCP 204.79.197.239:https > 192.168.88.192:50404 A / Padding
2025-03-02 14:59:53,621 - Ether / IP / TCP 204.79.197.239:https > 192.168.88.192:50404 A / Padding
2025-03-02 14:59:53,622 - Ether / IP / TCP 204.79.197.239:https > 192.168.88.192:50404 PA / Raw
2025-03-02 14:59:53,672 - Ether / IP / TCP 192.168.88.192:50404 > 204.79.197.239:https A
2025-03-02 14:59:53,812 - Ether / IP / UDP 192.168.88.192:65100 > 74.125.68.139:https / Raw
2025-03-02 14:59:53,887 - Ether / IP / UDP 74.125.68.139:https > 192.168.88.192:65100 / Raw
2025-03-02 14:59:53,923 - Ether / IP / TCP 204.79.197.239:https > 192.168.88.192:50404 PA / Raw
2025-03-02 14:59:53,924 - Ether / IP / TCP 204.79.197.239:https > 192.168.88.192:50404 PA / Raw
2025-03-02 14:59:53,924 - Ether / IP / TCP 192.168.88.192:50404 > 204.79.197.239:https A
2025-03-02 14:59:53,925 - Ether / IP / TCP 204.79.197.239:https > 192.168.88.192:50404 PA / Raw
2025-03-02 14:59:53,925 - Ether / IP / TCP 192.168.88.192:50404 > 204.79.197.239:https PA / Raw
2025-03-02 14:59:53,960 - Ether / IP / TCP 204.79.197.239:https > 192.168.88.192:50404 A / Padding
2025-03-02 14:59:54,007 - Ether / ARP who has 192.168.88.142 says 192.168.88.142 / Padding
2025-03-02 14:59:54,288 - Ether / IP / UDP 192.168.88.192:65100 > 74.125.68.139:https / Raw
2025-03-02 14:59:54,364 - Ether / IP / UDP 74.125.68.139:https > 192.168.88.192:65100 / Raw
2025-03-02 14:59:54,576 - Ether / IP / UDP / mDNS Qry b'BRWE86F389A94E9.local.'
2025-03-02 14:59:54,577 - Ether / IP / UDP 192.168.88.139:65284 > 224.0.0.252:llmnr / LLMNRQuery who has 'BRWE86F389A94E9.'
2025-03-02 14:59:54,631 - Ether / IP / TCP 192.168.88.192:50308 > 15.235.130.195:7000 PA / Raw
2025-03-02 14:59:54,761 - Ether / IP / TCP 15.235.130.195:7000 > 192.168.88.192:50308 PA / Raw
2025-03-02 14:59:54,762 - Ether / IP / TCP 192.168.88.192:50308 > 15.235.130.195:7000 PA / Raw
2025-03-02 14:59:54,899 - Ether / IP / UDP / mDNS Qry b'_companion-link._tcp.local.'
2025-03-02 14:59:54,935 - Ether / IP / TCP 15.235.130.195:7000 > 192.168.88.192:50308 A / Padding
2025-03-02 14:59:54,994 - Ether / IP / UDP 192.168.88.139:65284 > 224.0.0.252:llmnr / LLMNRQuery who has 'BRWE86F389A94E9.'
2025-03-02 14:59:55,134 - Ether / ARP who has 192.168.88.14 says 192.168.88.14 / Padding
2025-03-02 14:59:55,171 - Ether / IP / UDP 192.168.88.192:65100 > 74.125.68.139:https / Raw
2025-03-02 14:59:55,246 - Ether / IP / UDP 74.125.68.139:https > 192.168.88.192:65100 / Raw
2025-03-02 14:59:55,583 - Ether / IP / UDP / mDNS Qry b'BRWE86F389A94E9.local.'
2025-03-02 14:59:55,792 - Ether / IP / TCP 192.168.88.192:51578 > 157.240.235.19:https A / Raw
2025-03-02 14:59:55,793 - Ether / IP / TCP 192.168.88.192:51578 > 157.240.235.19:https A / Raw
2025-03-02 14:59:55,793 - Ether / IP / TCP 192.168.88.192:51578 > 157.240.235.19:https A / Raw
2025-03-02 14:59:55,794 - Ether / IP / TCP 192.168.88.192:51578 > 157.240.235.19:https A / Raw
2025-03-02 14:59:55,795 - Ether / IP / TCP 192.168.88.192:51578 > 157.240.235.19:https PA / Raw
2025-03-02 14:59:55,815 - Ether / IP / TCP 157.240.235.19:https > 192.168.88.192:51578 A / Padding
2025-03-02 14:59:55,815 - Ether / IP / TCP 157.240.235.19:https > 192.168.88.192:51578 A / Padding
2025-03-02 14:59:55,980 - Ether / IP / TCP 157.240.235.19:https > 192.168.88.192:51578 PA / Raw
2025-03-02 14:59:55,982 - Ether / IP / TCP 157.240.235.19:https > 192.168.88.192:51578 PA / Raw
2025-03-02 14:59:55,984 - Ether / IP / TCP 192.168.88.192:51578 > 157.240.235.19:https A
2025-03-02 14:59:55,985 - Ether / IP / TCP 192.168.88.192:51578 > 157.240.235.19:https PA / Raw
2025-03-02 14:59:56,007 - Ether / IP / TCP 157.240.235.19:https > 192.168.88.192:51578 A / Padding
2025-03-02 14:59:56,084 - Ether / IP / TCP 192.168.88.192:51569 > 13.107.246.59:https A / Raw
2025-03-02 14:59:56,115 - Ether / IP / TCP 13.107.246.59:https > 192.168.88.192:51569 A
2025-03-02 14:59:56,302 - Ether / IP / TCP 192.168.88.192:51407 > 13.69.239.78:https A / Raw
2025-03-02 14:59:56,319 - Ether / IP / TCP 192.168.88.192:50278 > 192.168.88.149:8009 PA / Raw
2025-03-02 14:59:56,390 - Ether / IP / UDP / mDNS Ans b'H\xc3\xb9ng si\xc3\xaau c\xe1\xba\xa5p provjp._companion-link._tcp.local.'
2025-03-02 14:59:56,443 - Ether / IP / UDP / mDNS Ans b'iPhone (2)._rdlink._tcp.local.'
2025-03-02 14:59:56,473 - Ether / IP / TCP 192.168.88.149:8009 > 192.168.88.192:50278 PA / Raw
2025-03-02 14:59:56,494 - Ether / IP / TCP 13.69.239.78:https > 192.168.88.192:51407 A
2025-03-02 14:59:56,503 - Ether / IP / TCP 192.168.88.192:50635 > 104.18.30.173:https A / Raw
2025-03-02 14:59:56,511 - Ether / 192.168.99.1 > 224.0.0.252 2 / Raw / Padding
2025-03-02 14:59:56,519 - Ether / IP / TCP 192.168.88.192:50278 > 192.168.88.149:8009 A
2025-03-02 14:59:56,527 - Ether / 192.168.99.1 > 224.0.0.252 2 / Raw / Padding
2025-03-02 14:59:56,530 - Ether / IP / UDP / mDNS Qry b'LAPTOP-VQJDVIG6.local.'
2025-03-02 14:59:56,534 - Ether / IP / UDP / mDNS Ans fe80::3db3:b6b5:6b7b:4736
2025-03-02 14:59:56,535 - Ether / IP / UDP 192.168.88.225:50631 > 224.0.0.252:llmnr / LLMNRQuery who has 'LAPTOP-VQJDVIG6.'
2025-03-02 14:59:56,540 - Ether / IP / TCP 104.18.30.173:https > 192.168.88.192:50635 A
2025-03-02 14:59:56,709 - Ether / IP / UDP / mDNS Ans 192.168.88.225
2025-03-02 14:59:56,860 - Ether / IP / UDP 192.168.88.192:65100 > 74.125.68.139:https / Raw
2025-03-02 14:59:56,890 - Ether / 192.168.88.192 > 224.0.0.252 2 / Raw
2025-03-02 14:59:56,940 - Ether / IP / UDP 74.125.68.139:https > 192.168.88.192:65100 / Raw
2025-03-02 14:59:56,969 - Ether / IP / UDP / mDNS Qry b'BRWE86F389A94E9.local.'
2025-03-02 14:59:56,972 - Ether / IP / UDP 192.168.88.139:59402 > 224.0.0.252:llmnr / LLMNRQuery who has 'BRWE86F389A94E9.'
2025-03-02 14:59:57,181 - Ether / ARP who has 192.168.88.14 says 192.168.88.14 / Padding
2025-03-02 14:59:57,385 - Ether / IP / UDP 192.168.88.139:59402 > 224.0.0.252:llmnr / LLMNRQuery who has 'BRWE86F389A94E9.'
2025-03-02 14:59:57,489 - Ether / ARP who has 192.168.88.14 says 192.168.88.14 / Padding
2025-03-02 14:59:57,783 - Ether / IP / TCP 192.168.88.192:51583 > 20.189.173.8:https S
2025-03-02 14:59:57,795 - Ether / ARP who has 192.168.88.14 says 192.168.88.14 / Padding
2025-03-02 14:59:57,972 - Ether / IP / UDP / mDNS Qry b'BRWE86F389A94E9.local.'
2025-03-02 14:59:57,973 - Ether / IP / TCP 20.189.173.8:https > 192.168.88.192:51583 SA
2025-03-02 14:59:57,974 - Ether / IP / TCP 192.168.88.192:51583 > 20.189.173.8:https A
2025-03-02 14:59:57,975 - Ether / IP / TCP 192.168.88.192:51583 > 20.189.173.8:https PA / Raw
2025-03-02 14:59:57,981 - Ether / Dot1Q / 192.168.99.1 > 224.0.0.251 2 / Raw / Padding
2025-03-02 14:59:58,164 - Ether / IP / TCP 20.189.173.8:https > 192.168.88.192:51583 PA / Raw
2025-03-02 14:59:58,165 - Ether / IP / TCP 192.168.88.192:51583 > 20.189.173.8:https PA / Raw
2025-03-02 14:59:58,257 - Ether / IP / UDP 172.253.118.95:https > 192.168.88.192:55724 / Raw
2025-03-02 14:59:58,277 - Ether / IP / UDP 192.168.88.192:55724 > 172.253.118.95:https / Raw
2025-03-02 14:59:58,359 - Ether / IP / TCP 20.189.173.8:https > 192.168.88.192:51583 A / Raw
2025-03-02 14:59:58,360 - Ether / IP / TCP 20.189.173.8:https > 192.168.88.192:51583 A / Raw
2025-03-02 14:59:58,361 - Ether / IP / TCP 192.168.88.192:51583 > 20.189.173.8:https A
2025-03-02 14:59:58,361 - Ether / IP / TCP 20.189.173.8:https > 192.168.88.192:51583 A / Raw
2025-03-02 14:59:58,362 - Ether / IP / TCP 20.189.173.8:https > 192.168.88.192:51583 PA / Raw
2025-03-02 14:59:58,362 - Ether / IP / TCP 192.168.88.192:51583 > 20.189.173.8:https A
2025-03-02 14:59:58,364 - Ether / IP / TCP 192.168.88.192:51583 > 20.189.173.8:https A / Raw
2025-03-02 14:59:58,364 - Ether / IP / TCP 192.168.88.192:51583 > 20.189.173.8:https A / Raw
2025-03-02 14:59:58,364 - Ether / IP / TCP 192.168.88.192:51583 > 20.189.173.8:https PA / Raw
2025-03-02 14:59:58,383 - Ether / Dot1Q / IP / UDP / mDNS Qry b'_companion-link._tcp.local.'
2025-03-02 14:59:58,386 - Ether / 192.168.88.192 > 224.0.0.251 2 / Raw
2025-03-02 14:59:58,420 - Ether / Dot1Q / IP / UDP / mDNS Ans b'Huu-Luans-MacBook-Air.local.'
2025-03-02 14:59:58,422 - Ether / Dot1Q / IP / UDP / mDNS Qry b'lb._dns-sd._udp.local.'
2025-03-02 14:59:58,425 - Ether / Dot1Q / IP / UDP / mDNS Qry b'H\xe1\xbb\xafu Lu\xc3\xa2n\xe2\x80\x99s MacBook Air._airplay._tcp.local.'
2025-03-02 14:59:58,549 - Ether / IP / TCP 20.189.173.8:https > 192.168.88.192:51583 A / Padding
2025-03-02 14:59:58,549 - Ether / IP / TCP 20.189.173.8:https > 192.168.88.192:51583 PA / Raw
2025-03-02 14:59:58,550 - Ether / IP / TCP 20.189.173.8:https > 192.168.88.192:51583 FPA / Raw
2025-03-02 14:59:58,551 - Ether / IP / TCP 192.168.88.192:51583 > 20.189.173.8:https A
2025-03-02 14:59:58,552 - Ether / IP / TCP 192.168.88.192:51583 > 20.189.173.8:https FA
2025-03-02 14:59:58,552 - Ether / IP / TCP 192.168.88.192:51583 > 20.189.173.8:https PA / Raw
2025-03-02 14:59:58,606 - Ether / IP / UDP / mDNS Ans b'iPhone (2)._rdlink._tcp.local.'
2025-03-02 14:59:58,615 - Ether / ARP who has 192.168.88.171 says 192.168.88.171
2025-03-02 14:59:58,621 - Ether / Dot1Q / IP / UDP / mDNS Ans b'iPhone c\xe1\xbb\xa7a T\xc3\xa2m._rdlink._tcp.local.'
2025-03-02 14:59:58,636 - Ether / IP / TCP 192.168.88.192:50402 > 20.212.88.117:https A / Raw
2025-03-02 14:59:58,664 - Ether / IP / TCP 20.212.88.117:https > 192.168.88.192:50402 A
2025-03-02 14:59:58,746 - Ether / IP / TCP 20.189.173.8:https > 192.168.88.192:51583 A / Padding
2025-03-02 14:59:58,747 - Ether / IP / TCP 20.189.173.8:https > 192.168.88.192:51583 A / Padding
2025-03-02 14:59:58,793 - Ether / IP / TCP 192.168.88.192:50244 > 157.240.235.15:https PA / Raw
2025-03-02 14:59:58,794 - Ether / IP / TCP 192.168.88.192:50247 > 157.240.235.15:https PA / Raw
2025-03-02 14:59:58,825 - Ether / IP / TCP 157.240.235.15:https > 192.168.88.192:50244 A / Padding
2025-03-02 14:59:58,829 - Ether / IP / TCP 157.240.235.15:https > 192.168.88.192:50247 A / Padding
2025-03-02 14:59:58,883 - Ether / Dot1Q / IP / UDP / mDNS Qry b'_companion-link._tcp.local.'
2025-03-02 14:59:58,978 - Ether / IP / TCP 157.240.235.15:https > 192.168.88.192:50244 PA / Raw
2025-03-02 14:59:58,982 - Ether / IP / TCP 157.240.235.15:https > 192.168.88.192:50247 PA / Raw
2025-03-02 14:59:58,993 - Ether / Dot1Q / 192.168.99.1 > 224.0.0.251 2 / Raw / Padding
2025-03-02 14:59:58,994 - Ether / IP / TCP 15.235.130.195:7000 > 192.168.88.192:50308 PA / Raw
2025-03-02 14:59:59,026 - Ether / IP / TCP 192.168.88.192:50244 > 157.240.235.15:https A
2025-03-02 14:59:59,026 - Ether / IP / TCP 192.168.88.192:50247 > 157.240.235.15:https A
2025-03-02 14:59:59,042 - Ether / IP / TCP 192.168.88.192:50308 > 15.235.130.195:7000 A
2025-03-02 14:59:59,086 - Ether / IP / UDP / mDNS Ans b'_mi-connect._udp.local.'
2025-03-02 14:59:59,151 - Ether / IP / TCP 157.240.235.19:https > 192.168.88.192:51578 PA / Raw
2025-03-02 14:59:59,152 - Ether / IP / TCP 192.168.88.192:51578 > 157.240.235.19:https FA
2025-03-02 14:59:59,153 - Ether / IP / TCP 157.240.235.19:https > 192.168.88.192:51578 RA / Padding
2025-03-02 14:59:59,156 - Ether / IP / TCP 192.168.88.192:51584 > 157.240.235.19:https S
2025-03-02 14:59:59,175 - Ether / IP / TCP 157.240.235.19:https > 192.168.88.192:51578 R / Padding
2025-03-02 14:59:59,183 - Ether / IP / TCP 157.240.235.19:https > 192.168.88.192:51584 SA
2025-03-02 14:59:59,184 - Ether / IP / TCP 192.168.88.192:51584 > 157.240.235.19:https A
2025-03-02 14:59:59,185 - Ether / IP / TCP 192.168.88.192:51584 > 157.240.235.19:https A / Raw
2025-03-02 14:59:59,185 - Ether / IP / TCP 192.168.88.192:51584 > 157.240.235.19:https PA / Raw
2025-03-02 14:59:59,217 - Ether / IP / TCP 157.240.235.19:https > 192.168.88.192:51584 A / Padding
2025-03-02 14:59:59,231 - Ether / IP / TCP 157.240.235.19:https > 192.168.88.192:51584 A / Padding
2025-03-02 14:59:59,237 - Ether / IP / TCP 157.240.235.19:https > 192.168.88.192:51584 PA / Raw
2025-03-02 14:59:59,238 - Ether / IP / TCP 192.168.88.192:51584 > 157.240.235.19:https PA / Raw
2025-03-02 14:59:59,239 - Ether / IP / TCP 192.168.88.192:51584 > 157.240.235.19:https PA / Raw
2025-03-02 14:59:59,250 - Ether / IP / TCP 157.240.235.19:https > 192.168.88.192:51584 A / Padding
2025-03-02 14:59:59,251 - Ether / IP / TCP 157.240.235.19:https > 192.168.88.192:51584 PA / Raw
2025-03-02 14:59:59,288 - Ether / IP / TCP 192.168.88.192:51584 > 157.240.235.19:https A
2025-03-02 14:59:59,305 - Ether / Dot1Q / IP / UDP / mDNS Qry b'_companion-link._tcp.local.'
2025-03-02 14:59:59,357 - Ether / IP / UDP / mDNS Qry b'BRWE86F389A94E9.local.'
2025-03-02 14:59:59,359 - Ether / IP / UDP 192.168.88.139:59566 > 224.0.0.252:llmnr / LLMNRQuery who has 'BRWE86F389A94E9.'
2025-03-02 14:59:59,384 - Ether / 192.168.88.192 > 224.0.0.251 2 / Raw
2025-03-02 14:59:59,403 - Ether / IP / TCP 157.240.235.19:https > 192.168.88.192:51584 A / Raw
2025-03-02 14:59:59,404 - Ether / IP / TCP 157.240.235.19:https > 192.168.88.192:51584 PA / Raw
2025-03-02 14:59:59,405 - Ether / IP / TCP 192.168.88.192:51584 > 157.240.235.19:https A
2025-03-02 14:59:59,405 - Ether / IP / TCP 192.168.88.192:51584 > 157.240.235.19:https PA / Raw
2025-03-02 14:59:59,406 - Ether / IP / TCP 192.168.88.192:51584 > 157.240.235.19:https PA / Raw
2025-03-02 14:59:59,408 - Ether / IP / TCP 192.168.88.192:51584 > 157.240.235.19:https PA / Raw
2025-03-02 14:59:59,409 - Ether / IP / TCP 192.168.88.192:51584 > 157.240.235.19:https PA / Raw
2025-03-02 14:59:59,410 - Ether / IP / TCP 192.168.88.192:51584 > 157.240.235.19:https PA / Raw
2025-03-02 14:59:59,411 - Ether / IP / TCP 192.168.88.192:51584 > 157.240.235.19:https PA / Raw
2025-03-02 14:59:59,412 - Ether / IP / TCP 192.168.88.192:51584 > 157.240.235.19:https PA / Raw
2025-03-02 14:59:59,412 - Ether / IP / TCP 192.168.88.192:51584 > 157.240.235.19:https PA / Raw
2025-03-02 14:59:59,413 - Ether / IP / TCP 192.168.88.192:51584 > 157.240.235.19:https PA / Raw
2025-03-02 14:59:59,433 - Ether / IP / TCP 157.240.235.19:https > 192.168.88.192:51584 A / Padding
2025-03-02 14:59:59,435 - Ether / IP / TCP 157.240.235.19:https > 192.168.88.192:51584 A / Padding
2025-03-02 14:59:59,517 - Ether / IP / UDP / mDNS Qry b'_spotify-connect._tcp.local.'
2025-03-02 14:59:59,561 - Ether / IP / UDP / mDNS Ans b'f0c3af753df670d0._spotify-connect._tcp.local.'
2025-03-02 14:59:59,586 - Ether / IP / TCP 157.240.235.19:https > 192.168.88.192:51584 PA / Raw
2025-03-02 14:59:59,587 - Ether / IP / TCP 192.168.88.192:51584 > 157.240.235.19:https A / Raw
2025-03-02 14:59:59,588 - Ether / IP / TCP 192.168.88.192:51584 > 157.240.235.19:https A / Raw
2025-03-02 14:59:59,589 - Ether / IP / TCP 192.168.88.192:51584 > 157.240.235.19:https A / Raw
2025-03-02 14:59:59,590 - Ether / IP / TCP 192.168.88.192:51584 > 157.240.235.19:https PA / Raw
2025-03-02 14:59:59,590 - Ether / IP / TCP 157.240.235.19:https > 192.168.88.192:51584 PA / Raw
2025-03-02 14:59:59,591 - Ether / IP / TCP 192.168.88.192:51584 > 157.240.235.19:https PA / Raw
2025-03-02 14:59:59,592 - Ether / IP / TCP 192.168.88.192:51584 > 157.240.235.19:https PA / Raw
2025-03-02 14:59:59,592 - Ether / IP / TCP 192.168.88.192:51584 > 157.240.235.19:https PA / Raw
2025-03-02 14:59:59,593 - Ether / IP / TCP 192.168.88.192:51584 > 157.240.235.19:https PA / Raw
2025-03-02 14:59:59,593 - Ether / IP / TCP 157.240.235.19:https > 192.168.88.192:51584 PA / Raw
2025-03-02 14:59:59,594 - Ether / IP / TCP 192.168.88.192:51584 > 157.240.235.19:https PA / Raw
2025-03-02 14:59:59,616 - Ether / IP / TCP 192.168.88.192:51584 > 157.240.235.19:https PA / Raw
2025-03-02 14:59:59,617 - Ether / IP / TCP 192.168.88.192:51584 > 157.240.235.19:https PA / Raw
2025-03-02 14:59:59,618 - Ether / IP / TCP 192.168.88.192:51584 > 157.240.235.19:https PA / Raw
2025-03-02 14:59:59,618 - Ether / IP / TCP 157.240.235.19:https > 192.168.88.192:51584 A / Padding
2025-03-02 14:59:59,619 - Ether / IP / TCP 157.240.235.19:https > 192.168.88.192:51584 A / Padding
2025-03-02 14:59:59,620 - Ether / IP / TCP 157.240.235.19:https > 192.168.88.192:51584 A / Padding
2025-03-02 14:59:59,658 - Ether / IP / TCP 157.240.235.19:https > 192.168.88.192:51584 A / Padding
2025-03-02 14:59:59,771 - Ether / IP / TCP 157.240.235.19:https > 192.168.88.192:51584 PA / Raw
2025-03-02 14:59:59,774 - Ether / IP / UDP 192.168.88.139:59566 > 224.0.0.252:llmnr / LLMNRQuery who has 'BRWE86F389A94E9.'
2025-03-02 14:59:59,775 - Ether / IP / TCP 157.240.235.19:https > 192.168.88.192:51584 PA / Raw
2025-03-02 14:59:59,776 - Ether / IP / TCP 192.168.88.192:51584 > 157.240.235.19:https A
2025-03-02 14:59:59,777 - Ether / IP / TCP 157.240.235.19:https > 192.168.88.192:51584 PA / Raw
2025-03-02 14:59:59,786 - Ether / IP / TCP 157.240.235.19:https > 192.168.88.192:51584 PA / Raw
2025-03-02 14:59:59,786 - Ether / IP / TCP 192.168.88.192:51584 > 157.240.235.19:https A
2025-03-02 14:59:59,787 - Ether / IP / TCP 192.168.88.192:51584 > 157.240.235.19:https PA / Raw
2025-03-02 14:59:59,789 - Ether / IP / TCP 157.240.235.19:https > 192.168.88.192:51584 PA / Raw
2025-03-02 14:59:59,789 - Ether / IP / TCP 192.168.88.192:51584 > 157.240.235.19:https PA / Raw
2025-03-02 14:59:59,792 - Ether / IP / TCP 157.240.235.19:https > 192.168.88.192:51584 PA / Raw
2025-03-02 14:59:59,793 - Ether / IP / TCP 192.168.88.192:51584 > 157.240.235.19:https PA / Raw
2025-03-02 14:59:59,794 - Ether / IP / TCP 157.240.235.19:https > 192.168.88.192:51584 PA / Raw
2025-03-02 14:59:59,797 - Ether / IP / TCP 157.240.235.19:https > 192.168.88.192:51584 PA / Raw
2025-03-02 14:59:59,797 - Ether / IP / TCP 192.168.88.192:51584 > 157.240.235.19:https A
2025-03-02 14:59:59,798 - Ether / IP / TCP 157.240.235.19:https > 192.168.88.192:51584 PA / Raw
2025-03-02 14:59:59,799 - Ether / IP / TCP 157.240.235.19:https > 192.168.88.192:51584 PA / Raw
2025-03-02 14:59:59,800 - Ether / IP / TCP 192.168.88.192:51584 > 157.240.235.19:https A
2025-03-02 14:59:59,801 - Ether / IP / TCP 192.168.88.192:51584 > 157.240.235.19:https PA / Raw
2025-03-02 14:59:59,801 - Ether / IP / TCP 157.240.235.19:https > 192.168.88.192:51584 PA / Raw
2025-03-02 14:59:59,802 - Ether / IP / TCP 192.168.88.192:51584 > 157.240.235.19:https PA / Raw
2025-03-02 14:59:59,803 - Ether / IP / TCP 192.168.88.192:51584 > 157.240.235.19:https PA / Raw
2025-03-02 14:59:59,803 - Ether / IP / TCP 157.240.235.19:https > 192.168.88.192:51584 PA / Raw
2025-03-02 14:59:59,804 - Ether / IP / TCP 192.168.88.192:51584 > 157.240.235.19:https PA / Raw
2025-03-02 14:59:59,813 - Ether / IP / TCP 157.240.235.19:https > 192.168.88.192:51584 A / Padding
2025-03-02 14:59:59,815 - Ether / 192.168.99.1 > 224.0.0.251 2 / Raw / Padding
2025-03-02 14:59:59,816 - Ether / IP / TCP 157.240.235.19:https > 192.168.88.192:51584 A / Padding
2025-03-02 14:59:59,819 - Ether / IP / TCP 157.240.235.19:https > 192.168.88.192:51584 A / Padding
2025-03-02 14:59:59,827 - Ether / IP / TCP 157.240.235.19:https > 192.168.88.192:51584 A / Padding
2025-03-02 14:59:59,829 - Ether / IP / TCP 157.240.235.19:https > 192.168.88.192:51584 A / Padding
2025-03-02 14:59:59,872 - Ether / IP / TCP 157.240.235.19:https > 192.168.88.192:51584 PA / Raw
2025-03-02 14:59:59,873 - Ether / IP / TCP 192.168.88.192:51584 > 157.240.235.19:https PA / Raw
2025-03-02 14:59:59,886 - Ether / 192.168.88.192 > 224.0.0.251 2 / Raw
2025-03-02 14:59:59,888 - Ether / Dot1Q / IP / UDP / mDNS Qry b'_companion-link._tcp.local.'
2025-03-02 14:59:59,895 - Ether / IP / TCP 157.240.235.19:https > 192.168.88.192:51584 PA / Raw
2025-03-02 14:59:59,896 - Ether / IP / TCP 192.168.88.192:51584 > 157.240.235.19:https PA / Raw
2025-03-02 14:59:59,900 - Ether / IP / TCP 157.240.235.19:https > 192.168.88.192:51584 A / Padding
2025-03-02 14:59:59,905 - Ether / IP / TCP 157.240.235.19:https > 192.168.88.192:51584 PA / Raw
2025-03-02 14:59:59,906 - Ether / IP / TCP 192.168.88.192:51584 > 157.240.235.19:https PA / Raw
2025-03-02 14:59:59,909 - Ether / IP / TCP 157.240.235.19:https > 192.168.88.192:51584 PA / Raw
2025-03-02 14:59:59,910 - Ether / IP / TCP 192.168.88.192:51584 > 157.240.235.19:https PA / Raw
2025-03-02 14:59:59,910 - Ether / IP / TCP 157.240.235.19:https > 192.168.88.192:51584 PA / Raw
2025-03-02 14:59:59,931 - Ether / IP / TCP 157.240.235.19:https > 192.168.88.192:51584 A / Padding
2025-03-02 14:59:59,944 - Ether / IP / TCP 157.240.235.19:https > 192.168.88.192:51584 PA / Raw
2025-03-02 14:59:59,945 - Ether / IP / TCP 192.168.88.192:51584 > 157.240.235.19:https A
2025-03-02 14:59:59,946 - Ether / IP / TCP 192.168.88.192:51584 > 157.240.235.19:https PA / Raw
2025-03-02 14:59:59,969 - Ether / IP / TCP 157.240.235.19:https > 192.168.88.192:51584 PA / Raw
2025-03-02 14:59:59,970 - Ether / IP / TCP 192.168.88.192:51584 > 157.240.235.19:https PA / Raw
2025-03-02 14:59:59,971 - Ether / IP / TCP 157.240.235.19:https > 192.168.88.192:51584 A / Raw
2025-03-02 14:59:59,972 - Ether / IP / TCP 192.168.88.192:51584 > 157.240.235.19:https A
2025-03-02 14:59:59,972 - Ether / IP / TCP 192.168.88.192:51584 > 157.240.235.19:https PA / Raw
2025-03-02 14:59:59,973 - Ether / IP / TCP 157.240.235.19:https > 192.168.88.192:51584 PA / Raw
2025-03-02 14:59:59,975 - Ether / IP / TCP 157.240.235.19:https > 192.168.88.192:51584 A / Raw
2025-03-02 14:59:59,975 - Ether / IP / TCP 157.240.235.19:https > 192.168.88.192:51584 PA / Raw
2025-03-02 14:59:59,976 - Ether / IP / TCP 192.168.88.192:51584 > 157.240.235.19:https A
2025-03-02 14:59:59,977 - Ether / IP / TCP 192.168.88.192:51584 > 157.240.235.19:https A
2025-03-02 14:59:59,977 - Ether / IP / TCP 157.240.235.19:https > 192.168.88.192:51584 A / Raw
2025-03-02 14:59:59,978 - Ether / IP / TCP 192.168.88.192:51584 > 157.240.235.19:https A
2025-03-02 14:59:59,979 - Ether / IP / TCP 157.240.235.19:https > 192.168.88.192:51584 PA / Raw
2025-03-02 14:59:59,979 - Ether / IP / TCP 192.168.88.192:51584 > 157.240.235.19:https A
2025-03-02 14:59:59,980 - Ether / IP / TCP 157.240.235.19:https > 192.168.88.192:51584 A / Raw
2025-03-02 14:59:59,981 - Ether / IP / TCP 157.240.235.19:https > 192.168.88.192:51584 PA / Raw
2025-03-02 14:59:59,981 - Ether / IP / TCP 192.168.88.192:51584 > 157.240.235.19:https A
2025-03-02 14:59:59,982 - Ether / IP / TCP 192.168.88.192:51584 > 157.240.235.19:https A
2025-03-02 14:59:59,982 - Ether / IP / TCP 157.240.235.19:https > 192.168.88.192:51584 A / Raw
2025-03-02 14:59:59,983 - Ether / IP / TCP 192.168.88.192:51584 > 157.240.235.19:https A
2025-03-02 14:59:59,983 - Ether / IP / TCP 157.240.235.19:https > 192.168.88.192:51584 PA / Raw
2025-03-02 14:59:59,984 - Ether / IP / TCP 192.168.88.192:51584 > 157.240.235.19:https A
2025-03-02 14:59:59,984 - Ether / IP / TCP 157.240.235.19:https > 192.168.88.192:51584 A / Raw
2025-03-02 14:59:59,985 - Ether / IP / TCP 192.168.88.192:51584 > 157.240.235.19:https A
2025-03-02 14:59:59,986 - Ether / IP / TCP 157.240.235.19:https > 192.168.88.192:51584 PA / Raw
2025-03-02 14:59:59,986 - Ether / IP / TCP 192.168.88.192:51584 > 157.240.235.19:https A
2025-03-02 14:59:59,987 - Ether / IP / TCP 157.240.235.19:https > 192.168.88.192:51584 A / Raw
2025-03-02 14:59:59,987 - Ether / IP / TCP 192.168.88.192:51584 > 157.240.235.19:https A
2025-03-02 14:59:59,988 - Ether / IP / TCP 157.240.235.19:https > 192.168.88.192:51584 PA / Raw
2025-03-02 14:59:59,989 - Ether / IP / TCP 192.168.88.192:51584 > 157.240.235.19:https A
2025-03-02 14:59:59,989 - Ether / IP / TCP 157.240.235.19:https > 192.168.88.192:51584 PA / Raw
2025-03-02 14:59:59,990 - Ether / IP / TCP 192.168.88.192:51584 > 157.240.235.19:https A
2025-03-02 14:59:59,990 - Ether / IP / TCP 192.168.88.192:51584 > 157.240.235.19:https PA / Raw
2025-03-02 14:59:59,997 - Ether / IP / TCP 157.240.235.19:https > 192.168.88.192:51584 A / Padding
2025-03-02 15:00:00,015 - Ether / Dot1Q / IP / UDP / mDNS Qry b'_rdlink._tcp.local.'
2025-03-02 15:00:00,027 - Ether / IP / UDP 192.168.88.83:63632 > 239.255.255.250:ssdp / Raw
2025-03-02 15:00:00,054 - Ether / IP / TCP 157.240.235.19:https > 192.168.88.192:51584 A / Padding
2025-03-02 15:00:00,102 - Ether / IP / TCP 157.240.235.19:https > 192.168.88.192:51584 PA / Raw
2025-03-02 15:00:00,152 - Ether / IP / TCP 157.240.235.19:https > 192.168.88.192:51584 PA / Raw
2025-03-02 15:00:00,152 - Ether / IP / TCP 192.168.88.192:51584 > 157.240.235.19:https A
2025-03-02 15:00:00,153 - Ether / IP / UDP 192.168.88.192:65100 > 74.125.68.139:https / Raw
2025-03-02 15:00:00,169 - Ether / IP / TCP 157.240.235.19:https > 192.168.88.192:51584 PA / Raw
2025-03-02 15:00:00,170 - Ether / IP / TCP 192.168.88.192:51584 > 157.240.235.19:https PA / Raw
2025-03-02 15:00:00,198 - Ether / IP / TCP 157.240.235.19:https > 192.168.88.192:51584 A / Padding
2025-03-02 15:00:00,227 - Ether / IP / UDP 74.125.68.139:https > 192.168.88.192:65100 / Raw
2025-03-02 15:00:00,253 - Ether / ARP who has 192.168.88.14 says 192.168.88.14 / Padding
2025-03-02 15:00:00,254 - Ether / ARP who has 192.168.88.14 says 192.168.88.14 / Padding
2025-03-02 15:00:00,255 - Ether / ARP who has 192.168.88.14 says 192.168.88.14 / Padding
2025-03-02 15:00:00,364 - Ether / IP / UDP / mDNS Qry b'BRWE86F389A94E9.local.'
2025-03-02 15:00:00,663 - Ether / ARP who has 192.168.88.171 says 192.168.88.171
2025-03-02 15:00:00,795 - Ether / IP / UDP 192.168.88.192:57210 > 172.217.194.102:https / Raw
2025-03-02 15:00:00,827 - Ether / IP / UDP 172.217.194.102:https > 192.168.88.192:57210 / Raw
2025-03-02 15:00:00,837 - Ether / IP / UDP 192.168.88.192:57210 > 172.217.194.102:https / Raw
2025-03-02 15:00:00,970 - Ether / ARP who has 192.168.88.171 says 192.168.88.171
2025-03-02 15:00:01,008 - Ether / IP / UDP 172.217.194.102:https > 192.168.88.192:57210 / Raw
2025-03-02 15:00:01,022 - Ether / IP / UDP 192.168.88.192:57210 > 172.217.194.102:https / Raw
2025-03-02 15:00:01,034 - Ether / Dot1Q / IP / UDP / mDNS Qry b'_rdlink._tcp.local.'
2025-03-02 15:00:01,053 - Ether / IP / UDP 172.217.194.102:https > 192.168.88.192:57210 / Raw
2025-03-02 15:00:01,277 - Ether / ARP who has 192.168.88.171 says 192.168.88.171
2025-03-02 15:00:01,298 - Ether / Dot1Q / IP / UDP / mDNS Ans b'Huu-Luans-MacBook-Air.local.'
2025-03-02 15:00:01,451 - Ether / Dot1Q / IP / UDP / mDNS Qry b'lb._dns-sd._udp.local.'
2025-03-02 15:00:01,487 - Ether / IP / TCP 192.168.88.192:50278 > 192.168.88.149:8009 PA / Raw
2025-03-02 15:00:01,509 - Ether / IP / TCP 192.168.88.149:8009 > 192.168.88.192:50278 PA / Raw
2025-03-02 15:00:01,529 - Ether / Dot1Q / 192.168.99.1 > 224.0.0.252 2 / Raw / Padding
2025-03-02 15:00:01,548 - Ether / IP / UDP / mDNS Qry b'DESKTOP-ILQ1N4B.local.'
2025-03-02 15:00:01,548 - Ether / IP / TCP 192.168.88.192:50278 > 192.168.88.149:8009 A
2025-03-02 15:00:01,551 - Ether / Dot1Q / 192.168.99.1 > 224.0.0.252 2 / Raw / Padding
2025-03-02 15:00:01,556 - Ether / IP / UDP / mDNS Ans fe80::97e4:c740:fc6d:f5c5
2025-03-02 15:00:01,557 - Ether / IP / UDP 192.168.88.78:59868 > 224.0.0.252:llmnr / LLMNRQuery who has 'DESKTOP-ILQ1N4B.'
2025-03-02 15:00:01,753 - Ether / IP / UDP / mDNS Qry b'BRWE86F389A94E9.local.'
2025-03-02 15:00:01,766 - Ether / IP / UDP 192.168.88.139:62406 > 224.0.0.252:llmnr / LLMNRQuery who has 'BRWE86F389A94E9.'
2025-03-02 15:00:01,809 - Ether / IP / UDP / mDNS Qry b'5bd9ae44-1551-196d-cc4d-8269fdefec40._googlezone._tcp.local.'
2025-03-02 15:00:01,812 - Ether / IP / UDP / mDNS Ans
2025-03-02 15:00:01,846 - Ether / Dot1Q / IP / UDP / mDNS Qry b'H\xe1\xbb\xafu Lu\xc3\xa2n\xe2\x80\x99s MacBook Air._airplay._tcp.local.'
2025-03-02 15:00:01,889 - Ether / 192.168.88.192 > 224.0.0.252 2 / Raw
2025-03-02 15:00:01,996 - Ether / ARP who has 192.168.88.134 says 192.168.88.134 / Padding
2025-03-02 15:00:02,049 - Ether / Dot1Q / IP / UDP / mDNS Qry b'H\xe1\xbb\xafu Lu\xc3\xa2n\xe2\x80\x99s MacBook Air._airplay._tcp.local.'
2025-03-02 15:00:02,136 - Ether / IP / TCP 192.168.88.192:50253 > 157.240.235.58:https PA / Raw
2025-03-02 15:00:02,162 - Ether / IP / UDP 192.168.88.139:62406 > 224.0.0.252:llmnr / LLMNRQuery who has 'BRWE86F389A94E9.'
2025-03-02 15:00:02,166 - Ether / IP / TCP 157.240.235.58:https > 192.168.88.192:50253 A / Padding
2025-03-02 15:00:02,182 - Ether / Dot1Q / IP / UDP / mDNS Ans b'Huu-Luans-MacBook-Air.local.'
2025-03-02 15:00:02,212 - Ether / IP / UDP / mDNS Qry b'_googlezone._tcp.local.'
2025-03-02 15:00:02,216 - Ether / IP / UDP / mDNS Ans b'5bd9ae44-1551-196d-cc4d-8269fdefec40._googlezone._tcp.local.'
2025-03-02 15:00:02,304 - Ether / Dot1Q / IP / UDP / mDNS Qry b'H\xe1\xbb\xafu Lu\xc3\xa2n\xe2\x80\x99s MacBook Air._airplay._tcp.local.'
2025-03-02 15:00:02,358 - Ether / IP / TCP 157.240.235.58:https > 192.168.88.192:50253 PA / Raw
2025-03-02 15:00:02,403 - Ether / IP / TCP 192.168.88.192:50253 > 157.240.235.58:https A
2025-03-02 15:00:02,456 - Ether / Dot1Q / IP / UDP / mDNS Qry b'lb._dns-sd._udp.local.'
2025-03-02 15:00:02,555 - Ether / ARP who has 192.168.88.192 says 192.168.88.1 / Padding
2025-03-02 15:00:02,556 - Ether / ARP is at 54:14:f3:ac:95:31 says 192.168.88.192
2025-03-02 15:00:02,563 - Ether / Dot1Q / IP / UDP / mDNS Ans [b'act=2', b'acl=0', b'deviceid=02:C4:A4:71:F7:B0', b'fex=1c9/St5PF7g2IQw', b'features=0x4A7FCFD5,0xB8174FDE', b'rsf=0x8', b'flags=0x204', b'gid=8F519645-BA17-450D-88AD-E44720D7A58C', b'igl=0', b'gcgl=0', b'model=MacBookAir10,1', b'at=4', b'protovers=1.1', b'pi=39f711c9-98c7-4d51-a5ba-6e1399d920f8', b'psi=02C4A471-F7B0-4E8E-9859-4B82F610AA43', b'pk=1fa04ac043f35888ef116815ec7f79f2737e82cafe557c8f87928aee796e6a84', b'srcvers=830.10.1']
2025-03-02 15:00:02,619 - Ether / 192.168.99.1 > 224.0.0.252 2 / Raw / Padding
2025-03-02 15:00:02,644 - Ether / IP / UDP / mDNS Qry b'DESKTOP-JP0V779.local.'
2025-03-02 15:00:02,649 - Ether / IP / UDP / mDNS Ans 192.168.88.160
2025-03-02 15:00:02,656 - Ether / IP / UDP / mDNS Ans fe80::ed86:3986:6b12:2556
2025-03-02 15:00:02,657 - Ether / 192.168.99.1 > 224.0.0.252 2 / Raw / Padding
2025-03-02 15:00:02,658 - Ether / IP / UDP / mDNS Qry b'DESKTOP-JP0V779.local.'
2025-03-02 15:00:02,660 - Ether / IP / UDP / mDNS Ans fe80::ed86:3986:6b12:2556
2025-03-02 15:00:02,661 - Ether / IP / UDP 192.168.88.160:62667 > 224.0.0.252:llmnr / LLMNRQuery who has 'DESKTOP-JP0V779.'
2025-03-02 15:00:02,713 - Ether / IP / UDP / mDNS Ans 192.168.88.160
2025-03-02 15:00:02,755 - Ether / IP / UDP / mDNS Qry b'BRWE86F389A94E9.local.'
2025-03-02 15:00:02,883 - Ether / 192.168.88.192 > 224.0.0.252 2 / Raw
2025-03-02 15:00:02,891 - Ether / Dot1Q / IP / UDP / mDNS Qry b'_companion-link._tcp.local.'
2025-03-02 15:00:03,270 - Ether / IP / TCP 192.168.88.192:51529 > 185.199.109.133:https A / Raw
2025-03-02 15:00:03,428 - Ether / ARP who has 192.168.88.166 says 192.168.88.166
2025-03-02 15:00:03,433 - Ether / IP / TCP 185.199.109.133:https > 192.168.88.192:51529 A
2025-03-02 15:00:03,562 - Ether / Dot1Q / IP / UDP / mDNS Ans [b'act=2', b'acl=0', b'deviceid=02:C4:A4:71:F7:B0', b'fex=1c9/St5PF7g2IQw', b'features=0x4A7FCFD5,0xB8174FDE', b'rsf=0x8', b'flags=0x204', b'gid=8F519645-BA17-450D-88AD-E44720D7A58C', b'igl=0', b'gcgl=0', b'model=MacBookAir10,1', b'at=4', b'protovers=1.1', b'pi=39f711c9-98c7-4d51-a5ba-6e1399d920f8', b'psi=02C4A471-F7B0-4E8E-9859-4B82F610AA43', b'pk=1fa04ac043f35888ef116815ec7f79f2737e82cafe557c8f87928aee796e6a84', b'srcvers=830.10.1']
2025-03-02 15:00:03,942 - Ether / ARP who has 192.168.88.142 says 192.168.88.142 / Padding
2025-03-02 15:00:04,140 - Ether / IP / UDP / mDNS Qry b'BRWE86F389A94E9.local.'
2025-03-02 15:00:04,141 - Ether / IP / UDP 192.168.88.139:55674 > 224.0.0.252:llmnr / LLMNRQuery who has 'BRWE86F389A94E9.'
2025-03-02 15:00:04,207 - Ether / Dot1Q / IP / UDP / mDNS Ans b'Huu-Luans-MacBook-Air.local.'
2025-03-02 15:00:04,551 - Ether / IP / UDP 192.168.88.139:55674 > 224.0.0.252:llmnr / LLMNRQuery who has 'BRWE86F389A94E9.'
2025-03-02 15:00:04,672 - Ether / IP / UDP / mDNS Ans b'iPhone (2)._rdlink._tcp.local.'
2025-03-02 15:00:04,676 - Ether / IP / UDP / mDNS Ans b'H\xc3\xb9ng si\xc3\xaau c\xe1\xba\xa5p provjp._companion-link._tcp.local.'
2025-03-02 15:00:04,814 - Ether / IP / TCP 192.168.88.192:50628 > 40.99.10.34:https A / Raw
2025-03-02 15:00:04,843 - Ether / IP / TCP 40.99.10.34:https > 192.168.88.192:50628 A
2025-03-02 15:00:04,934 - Ether / Dot1Q / IP / UDP / mDNS Ans [b'act=2', b'acl=0', b'deviceid=02:C4:A4:71:F7:B0', b'fex=1c9/St5PF7g2IQw', b'features=0x4A7FCFD5,0xB8174FDE', b'rsf=0x8', b'flags=0x204', b'gid=8F519645-BA17-450D-88AD-E44720D7A58C', b'igl=0', b'gcgl=0', b'model=MacBookAir10,1', b'at=4', b'protovers=1.1', b'pi=39f711c9-98c7-4d51-a5ba-6e1399d920f8', b'psi=02C4A471-F7B0-4E8E-9859-4B82F610AA43', b'pk=1fa04ac043f35888ef116815ec7f79f2737e82cafe557c8f87928aee796e6a84', b'srcvers=830.10.1']
2025-03-02 15:00:05,447 - Ether / IP / UDP 192.168.88.192:65263 > 74.125.130.95:https / Raw
2025-03-02 15:00:05,463 - Ether / Dot1Q / IP / UDP / mDNS Qry b'lb._dns-sd._udp.local.'
2025-03-02 15:00:05,476 - Ether / ARP who has 192.168.88.166 says 192.168.88.166
2025-03-02 15:00:05,489 - Ether / IP / UDP 74.125.130.95:https > 192.168.88.192:65263 / Raw
2025-03-02 15:00:05,783 - Ether / ARP who has 192.168.88.166 says 192.168.88.166
2025-03-02 15:00:06,002 - Ether / IP / TCP 192.168.88.192:50257 > 157.240.235.15:https PA / Raw
2025-03-02 15:00:06,029 - Ether / IP / TCP 157.240.235.15:https > 192.168.88.192:50257 A / Padding
2025-03-02 15:00:06,092 - Ether / ARP who has 192.168.88.166 says 192.168.88.166
2025-03-02 15:00:06,100 - Ether / 192.168.99.1 > 224.0.0.251 2 / Raw / Padding
2025-03-02 15:00:06,201 - Ether / Dot1Q / IP / UDP / mDNS Qry b'_companion-link._tcp.local.'
2025-03-02 15:00:06,209 - Ether / IP / TCP 157.240.235.15:https > 192.168.88.192:50257 PA / Raw
2025-03-02 15:00:06,264 - Ether / IP / TCP 192.168.88.192:50257 > 157.240.235.15:https A
2025-03-02 15:00:06,388 - Ether / 192.168.88.192 > 224.0.0.251 2 / Raw
2025-03-02 15:00:06,511 - Ether / IP / TCP 192.168.88.192:50278 > 192.168.88.149:8009 PA / Raw
2025-03-02 15:00:06,532 - Ether / IP / UDP / mDNS Qry b'BRWE86F389A94E9.local.'
2025-03-02 15:00:06,533 - Ether / IP / UDP 192.168.88.139:54559 > 224.0.0.252:llmnr / LLMNRQuery who has 'BRWE86F389A94E9.'
2025-03-02 15:00:06,571 - Ether / IP / TCP 192.168.88.149:8009 > 192.168.88.192:50278 PA / Raw
2025-03-02 15:00:06,588 - Ether / IP / UDP / mDNS Qry b'Android-6.local.'
2025-03-02 15:00:06,617 - Ether / IP / TCP 192.168.88.192:50278 > 192.168.88.149:8009 A
2025-03-02 15:00:06,634 - Ether / IP / UDP 192.168.88.192:65100 > 74.125.68.139:https / Raw
2025-03-02 15:00:06,716 - Ether / IP / UDP 74.125.68.139:https > 192.168.88.192:65100 / Raw
2025-03-02 15:00:06,840 - Ether / IP / UDP / mDNS Qry b'Android-6.local.'
2025-03-02 15:00:06,949 - Ether / IP / UDP 192.168.88.139:54559 > 224.0.0.252:llmnr / LLMNRQuery who has 'BRWE86F389A94E9.'
2025-03-02 15:00:06,993 - Ether / IP / UDP 74.125.130.95:https > 192.168.88.192:65263 / Raw
2025-03-02 15:00:07,006 - Ether / IP / UDP 192.168.88.192:65263 > 74.125.130.95:https / Raw
2025-03-02 15:00:07,200 - Ether / Dot1Q / IP / UDP / mDNS Qry b'_companion-link._tcp.local.'
2025-03-02 15:00:07,343 - Ether / IP / UDP / mDNS Ans b'Android-6.local.'
2025-03-02 15:00:07,522 - Ether / IP / UDP / mDNS Qry b'BRWE86F389A94E9.local.'
2025-03-02 15:00:08,211 - Ether / Dot1Q / IP / UDP / mDNS Ans [b'act=2', b'acl=0', b'deviceid=02:C4:A4:71:F7:B0', b'fex=1c9/St5PF7g2IQw', b'features=0x4A7FCFD5,0xB8174FDE', b'rsf=0x8', b'flags=0x204', b'gid=8F519645-BA17-450D-88AD-E44720D7A58C', b'igl=0', b'gcgl=0', b'model=MacBookAir10,1', b'at=4', b'protovers=1.1', b'pi=39f711c9-98c7-4d51-a5ba-6e1399d920f8', b'psi=02C4A471-F7B0-4E8E-9859-4B82F610AA43', b'pk=1fa04ac043f35888ef116815ec7f79f2737e82cafe557c8f87928aee796e6a84', b'srcvers=830.10.1']
2025-03-02 15:00:08,547 - Ether / Dot1Q / IP / UDP / mDNS Ans b'MacBook Air c\xe1\xbb\xa7a Quyen._smb._tcp.local.'
2025-03-02 15:00:08,605 - Ether / IP / UDP 192.168.88.93:51934 > 239.255.255.250:ssdp / Raw
2025-03-02 15:00:08,903 - Ether / IP / UDP / mDNS Qry b'BRWE86F389A94E9.local.'
2025-03-02 15:00:08,904 - Ether / IP / UDP 192.168.88.139:55578 > 224.0.0.252:llmnr / LLMNRQuery who has 'BRWE86F389A94E9.'
2025-03-02 15:00:09,324 - Ether / IP / UDP 192.168.88.139:55578 > 224.0.0.252:llmnr / LLMNRQuery who has 'BRWE86F389A94E9.'
2025-03-02 15:00:09,355 - Ether / IP / TCP 192.168.88.192:50308 > 15.235.130.195:7000 PA / Raw
2025-03-02 15:00:09,469 - Ether / IP / TCP 15.235.130.195:7000 > 192.168.88.192:50308 PA / Raw
2025-03-02 15:00:09,469 - Ether / IP / TCP 192.168.88.192:50308 > 15.235.130.195:7000 PA / Raw
2025-03-02 15:00:09,649 - Ether / IP / TCP 15.235.130.195:7000 > 192.168.88.192:50308 A / Padding
2025-03-02 15:00:09,796 - Ether / IP / TCP 157.240.235.19:https > 192.168.88.192:51584 PA / Raw
2025-03-02 15:00:09,796 - Ether / IP / TCP 157.240.235.19:https > 192.168.88.192:51584 RA / Padding
2025-03-02 15:00:09,805 - Ether / IP / TCP 192.168.88.192:51585 > 157.240.235.19:https S
2025-03-02 15:00:09,833 - Ether / IP / TCP 157.240.235.19:https > 192.168.88.192:51585 SA
2025-03-02 15:00:09,834 - Ether / IP / TCP 192.168.88.192:51585 > 157.240.235.19:https A
2025-03-02 15:00:09,835 - Ether / IP / TCP 192.168.88.192:51585 > 157.240.235.19:https A / Raw
2025-03-02 15:00:09,836 - Ether / IP / TCP 192.168.88.192:51585 > 157.240.235.19:https PA / Raw
2025-03-02 15:00:09,862 - Ether / IP / TCP 157.240.235.19:https > 192.168.88.192:51585 A / Padding
2025-03-02 15:00:09,863 - Ether / IP / TCP 157.240.235.19:https > 192.168.88.192:51585 A / Padding
2025-03-02 15:00:09,864 - Ether / IP / TCP 157.240.235.19:https > 192.168.88.192:51585 PA / Raw
2025-03-02 15:00:09,865 - Ether / IP / TCP 192.168.88.192:51585 > 157.240.235.19:https PA / Raw
2025-03-02 15:00:09,865 - Ether / IP / TCP 192.168.88.192:51585 > 157.240.235.19:https PA / Raw
2025-03-02 15:00:09,892 - Ether / IP / TCP 157.240.235.19:https > 192.168.88.192:51585 PA / Raw
2025-03-02 15:00:09,913 - Ether / IP / UDP / mDNS Qry b'BRWE86F389A94E9.local.'
2025-03-02 15:00:09,932 - Ether / IP / TCP 157.240.235.19:https > 192.168.88.192:51585 A / Padding
2025-03-02 15:00:09,943 - Ether / IP / TCP 192.168.88.192:51585 > 157.240.235.19:https A
2025-03-02 15:00:10,047 - Ether / IP / TCP 157.240.235.19:https > 192.168.88.192:51585 A / Raw
2025-03-02 15:00:10,048 - Ether / IP / TCP 157.240.235.19:https > 192.168.88.192:51585 PA / Raw
2025-03-02 15:00:10,049 - Ether / IP / TCP 192.168.88.192:51585 > 157.240.235.19:https A
2025-03-02 15:00:10,050 - Ether / IP / TCP 192.168.88.192:51585 > 157.240.235.19:https PA / Raw
2025-03-02 15:00:10,052 - Ether / IP / TCP 192.168.88.192:51585 > 157.240.235.19:https PA / Raw
2025-03-02 15:00:10,052 - Ether / IP / TCP 192.168.88.192:51585 > 157.240.235.19:https PA / Raw
2025-03-02 15:00:10,053 - Ether / IP / TCP 192.168.88.192:51585 > 157.240.235.19:https PA / Raw
2025-03-02 15:00:10,053 - Ether / IP / TCP 192.168.88.192:51585 > 157.240.235.19:https PA / Raw
2025-03-02 15:00:10,054 - Ether / IP / TCP 192.168.88.192:51585 > 157.240.235.19:https PA / Raw
2025-03-02 15:00:10,055 - Ether / IP / TCP 192.168.88.192:51585 > 157.240.235.19:https PA / Raw
2025-03-02 15:00:10,055 - Ether / IP / TCP 192.168.88.192:51585 > 157.240.235.19:https PA / Raw
2025-03-02 15:00:10,056 - Ether / IP / TCP 192.168.88.192:51585 > 157.240.235.19:https PA / Raw
2025-03-02 15:00:10,076 - Ether / IP / TCP 157.240.235.19:https > 192.168.88.192:51585 A / Padding
2025-03-02 15:00:10,078 - Ether / IP / TCP 157.240.235.19:https > 192.168.88.192:51585 A / Padding
2025-03-02 15:00:10,079 - Ether / IP / TCP 157.240.235.19:https > 192.168.88.192:51585 A / Padding
2025-03-02 15:00:10,080 - Ether / IP / TCP 157.240.235.19:https > 192.168.88.192:51585 A / Padding
2025-03-02 15:00:10,080 - Ether / IP / TCP 157.240.235.19:https > 192.168.88.192:51585 A / Padding
2025-03-02 15:00:10,081 - Ether / IP / TCP 157.240.235.19:https > 192.168.88.192:51585 A / Padding
2025-03-02 15:00:10,081 - Ether / IP / TCP 157.240.235.19:https > 192.168.88.192:51585 A / Padding
2025-03-02 15:00:10,082 - Ether / IP / TCP 157.240.235.19:https > 192.168.88.192:51585 A / Padding
2025-03-02 15:00:10,082 - Ether / IP / TCP 157.240.235.19:https > 192.168.88.192:51585 A / Padding
2025-03-02 15:00:10,193 - Ether / Dot1Q / IP / UDP / mDNS Qry b'_companion-link._tcp.local.'
2025-03-02 15:00:10,230 - Ether / IP / TCP 157.240.235.19:https > 192.168.88.192:51585 PA / Raw
2025-03-02 15:00:10,231 - Ether / IP / TCP 192.168.88.192:51585 > 157.240.235.19:https A / Raw
2025-03-02 15:00:10,231 - Ether / IP / TCP 192.168.88.192:51585 > 157.240.235.19:https A / Raw
2025-03-02 15:00:10,232 - Ether / IP / TCP 192.168.88.192:51585 > 157.240.235.19:https A / Raw
2025-03-02 15:00:10,234 - Ether / IP / TCP 192.168.88.192:51585 > 157.240.235.19:https PA / Raw
2025-03-02 15:00:10,234 - Ether / IP / TCP 157.240.235.19:https > 192.168.88.192:51585 PA / Raw
2025-03-02 15:00:10,235 - Ether / IP / TCP 192.168.88.192:51585 > 157.240.235.19:https PA / Raw
2025-03-02 15:00:10,235 - Ether / IP / TCP 192.168.88.192:51585 > 157.240.235.19:https PA / Raw
2025-03-02 15:00:10,236 - Ether / IP / TCP 192.168.88.192:51585 > 157.240.235.19:https PA / Raw
2025-03-02 15:00:10,236 - Ether / IP / TCP 192.168.88.192:51585 > 157.240.235.19:https PA / Raw
2025-03-02 15:00:10,237 - Ether / IP / TCP 192.168.88.192:51585 > 157.240.235.19:https PA / Raw
2025-03-02 15:00:10,238 - Ether / IP / TCP 192.168.88.192:51585 > 157.240.235.19:https PA / Raw
2025-03-02 15:00:10,238 - Ether / IP / TCP 192.168.88.192:51585 > 157.240.235.19:https PA / Raw
2025-03-02 15:00:10,239 - Ether / IP / TCP 192.168.88.192:51585 > 157.240.235.19:https PA / Raw
2025-03-02 15:00:10,259 - Ether / IP / TCP 157.240.235.19:https > 192.168.88.192:51585 A / Padding
2025-03-02 15:00:10,260 - Ether / IP / TCP 157.240.235.19:https > 192.168.88.192:51585 A / Padding
2025-03-02 15:00:10,260 - Ether / IP / TCP 157.240.235.19:https > 192.168.88.192:51585 A / Padding
2025-03-02 15:00:10,261 - Ether / IP / TCP 157.240.235.19:https > 192.168.88.192:51585 A / Padding
2025-03-02 15:00:10,262 - Ether / IP / TCP 157.240.235.19:https > 192.168.88.192:51585 A / Padding
2025-03-02 15:00:10,262 - Ether / IP / TCP 157.240.235.19:https > 192.168.88.192:51585 A / Padding
2025-03-02 15:00:10,263 - Ether / IP / TCP 157.240.235.19:https > 192.168.88.192:51585 A / Padding
2025-03-02 15:00:10,263 - Ether / IP / TCP 157.240.235.19:https > 192.168.88.192:51585 A / Padding
2025-03-02 15:00:10,264 - Ether / IP / TCP 157.240.235.19:https > 192.168.88.192:51585 A / Padding
2025-03-02 15:00:10,264 - Ether / IP / TCP 157.240.235.19:https > 192.168.88.192:51585 A / Padding
2025-03-02 15:00:10,418 - Ether / IP / TCP 157.240.235.19:https > 192.168.88.192:51585 PA / Raw
2025-03-02 15:00:10,426 - Ether / IP / TCP 157.240.235.19:https > 192.168.88.192:51585 PA / Raw
2025-03-02 15:00:10,427 - Ether / IP / TCP 192.168.88.192:51585 > 157.240.235.19:https A
2025-03-02 15:00:10,430 - Ether / IP / TCP 157.240.235.19:https > 192.168.88.192:51585 PA / Raw
2025-03-02 15:00:10,430 - Ether / IP / TCP 192.168.88.192:51585 > 157.240.235.19:https PA / Raw
2025-03-02 15:00:10,431 - Ether / IP / TCP 192.168.88.192:51585 > 157.240.235.19:https PA / Raw
2025-03-02 15:00:10,441 - Ether / IP / TCP 157.240.235.19:https > 192.168.88.192:51585 PA / Raw
2025-03-02 15:00:10,442 - Ether / IP / TCP 192.168.88.192:51585 > 157.240.235.19:https A
2025-03-02 15:00:10,442 - Ether / IP / TCP 157.240.235.19:https > 192.168.88.192:51585 PA / Raw
2025-03-02 15:00:10,443 - Ether / IP / TCP 192.168.88.192:51585 > 157.240.235.19:https A
2025-03-02 15:00:10,444 - Ether / IP / TCP 157.240.235.19:https > 192.168.88.192:51585 PA / Raw
2025-03-02 15:00:10,445 - Ether / IP / TCP 157.240.235.19:https > 192.168.88.192:51585 PA / Raw
2025-03-02 15:00:10,445 - Ether / IP / TCP 192.168.88.192:51585 > 157.240.235.19:https A
2025-03-02 15:00:10,446 - Ether / IP / TCP 192.168.88.192:51585 > 157.240.235.19:https PA / Raw
2025-03-02 15:00:10,447 - Ether / IP / TCP 157.240.235.19:https > 192.168.88.192:51585 PA / Raw
2025-03-02 15:00:10,447 - Ether / IP / TCP 192.168.88.192:51585 > 157.240.235.19:https PA / Raw
2025-03-02 15:00:10,448 - Ether / IP / TCP 157.240.235.19:https > 192.168.88.192:51585 PA / Raw
2025-03-02 15:00:10,448 - Ether / IP / TCP 192.168.88.192:51585 > 157.240.235.19:https PA / Raw
2025-03-02 15:00:10,452 - Ether / IP / TCP 157.240.235.19:https > 192.168.88.192:51585 PA / Raw
2025-03-02 15:00:10,453 - Ether / IP / TCP 192.168.88.192:51585 > 157.240.235.19:https PA / Raw
2025-03-02 15:00:10,454 - Ether / IP / TCP 157.240.235.19:https > 192.168.88.192:51585 PA / Raw
2025-03-02 15:00:10,455 - Ether / IP / TCP 192.168.88.192:51585 > 157.240.235.19:https PA / Raw
2025-03-02 15:00:10,456 - Ether / IP / TCP 157.240.235.19:https > 192.168.88.192:51585 A / Padding
2025-03-02 15:00:10,457 - Ether / IP / TCP 157.240.235.19:https > 192.168.88.192:51585 A / Padding
2025-03-02 15:00:10,471 - Ether / IP / TCP 157.240.235.19:https > 192.168.88.192:51585 A / Padding
2025-03-02 15:00:10,473 - Ether / IP / TCP 157.240.235.19:https > 192.168.88.192:51585 A / Padding
2025-03-02 15:00:10,474 - Ether / IP / TCP 157.240.235.19:https > 192.168.88.192:51585 A / Padding
2025-03-02 15:00:10,479 - Ether / IP / TCP 157.240.235.19:https > 192.168.88.192:51585 A / Padding
2025-03-02 15:00:10,481 - Ether / IP / TCP 157.240.235.19:https > 192.168.88.192:51585 A / Padding
2025-03-02 15:00:10,530 - Ether / IP / TCP 157.240.235.19:https > 192.168.88.192:51585 PA / Raw
2025-03-02 15:00:10,531 - Ether / IP / TCP 192.168.88.192:51585 > 157.240.235.19:https PA / Raw
2025-03-02 15:00:10,536 - Ether / IP / TCP 157.240.235.19:https > 192.168.88.192:51585 PA / Raw
2025-03-02 15:00:10,537 - Ether / IP / TCP 192.168.88.192:51585 > 157.240.235.19:https PA / Raw
2025-03-02 15:00:10,548 - Ether / IP / TCP 157.240.235.19:https > 192.168.88.192:51585 PA / Raw
2025-03-02 15:00:10,578 - Ether / IP / TCP 157.240.235.19:https > 192.168.88.192:51585 PA / Raw
2025-03-02 15:00:10,579 - Ether / IP / TCP 192.168.88.192:51585 > 157.240.235.19:https A
2025-03-02 15:00:10,579 - Ether / IP / TCP 157.240.235.19:https > 192.168.88.192:51585 A / Padding
2025-03-02 15:00:10,580 - Ether / IP / TCP 157.240.235.19:https > 192.168.88.192:51585 A / Padding
2025-03-02 15:00:10,581 - Ether / IP / TCP 192.168.88.192:51585 > 157.240.235.19:https PA / Raw
2025-03-02 15:00:10,590 - Ether / IP / TCP 157.240.235.19:https > 192.168.88.192:51585 PA / Raw
2025-03-02 15:00:10,591 - Ether / IP / TCP 192.168.88.192:51585 > 157.240.235.19:https PA / Raw
2025-03-02 15:00:10,607 - Ether / IP / TCP 157.240.235.19:https > 192.168.88.192:51585 PA / Raw
2025-03-02 15:00:10,608 - Ether / IP / TCP 192.168.88.192:51585 > 157.240.235.19:https PA / Raw
2025-03-02 15:00:10,635 - Ether / IP / TCP 157.240.235.19:https > 192.168.88.192:51585 A / Padding
2025-03-02 15:00:10,744 - Ether / IP / TCP 157.240.235.19:https > 192.168.88.192:51585 PA / Raw
2025-03-02 15:00:10,745 - Ether / IP / TCP 157.240.235.19:https > 192.168.88.192:51585 A / Raw
2025-03-02 15:00:10,746 - Ether / IP / TCP 192.168.88.192:51585 > 157.240.235.19:https A
2025-03-02 15:00:10,746 - Ether / IP / TCP 192.168.88.192:51585 > 157.240.235.19:https PA / Raw
2025-03-02 15:00:10,746 - Ether / IP / TCP 157.240.235.19:https > 192.168.88.192:51585 PA / Raw
2025-03-02 15:00:10,747 - Ether / IP / TCP 192.168.88.192:51585 > 157.240.235.19:https PA / Raw
2025-03-02 15:00:10,749 - Ether / IP / TCP 157.240.235.19:https > 192.168.88.192:51585 A / Raw
2025-03-02 15:00:10,750 - Ether / IP / TCP 192.168.88.192:51585 > 157.240.235.19:https A
2025-03-02 15:00:10,750 - Ether / IP / TCP 157.240.235.19:https > 192.168.88.192:51585 PA / Raw
2025-03-02 15:00:10,751 - Ether / IP / TCP 192.168.88.192:51585 > 157.240.235.19:https A
2025-03-02 15:00:10,751 - Ether / IP / TCP 157.240.235.19:https > 192.168.88.192:51585 A / Raw
2025-03-02 15:00:10,752 - Ether / IP / TCP 192.168.88.192:51585 > 157.240.235.19:https A
2025-03-02 15:00:10,752 - Ether / IP / TCP 157.240.235.19:https > 192.168.88.192:51585 PA / Raw
2025-03-02 15:00:10,753 - Ether / IP / TCP 192.168.88.192:51585 > 157.240.235.19:https A
2025-03-02 15:00:10,753 - Ether / IP / TCP 157.240.235.19:https > 192.168.88.192:51585 A / Raw
2025-03-02 15:00:10,754 - Ether / IP / TCP 192.168.88.192:51585 > 157.240.235.19:https A
2025-03-02 15:00:10,755 - Ether / IP / TCP 157.240.235.19:https > 192.168.88.192:51585 PA / Raw
2025-03-02 15:00:10,755 - Ether / IP / TCP 192.168.88.192:51585 > 157.240.235.19:https A
2025-03-02 15:00:10,756 - Ether / IP / TCP 157.240.235.19:https > 192.168.88.192:51585 A / Raw
2025-03-02 15:00:10,756 - Ether / IP / TCP 192.168.88.192:51585 > 157.240.235.19:https A
2025-03-02 15:00:10,757 - Ether / IP / TCP 157.240.235.19:https > 192.168.88.192:51585 PA / Raw
2025-03-02 15:00:10,758 - Ether / IP / TCP 192.168.88.192:51585 > 157.240.235.19:https A
2025-03-02 15:00:10,758 - Ether / IP / TCP 157.240.235.19:https > 192.168.88.192:51585 A / Raw
2025-03-02 15:00:10,759 - Ether / IP / TCP 192.168.88.192:51585 > 157.240.235.19:https A
2025-03-02 15:00:10,760 - Ether / IP / TCP 157.240.235.19:https > 192.168.88.192:51585 PA / Raw
2025-03-02 15:00:10,760 - Ether / IP / TCP 192.168.88.192:51585 > 157.240.235.19:https A
2025-03-02 15:00:10,761 - Ether / IP / TCP 157.240.235.19:https > 192.168.88.192:51585 A / Raw
2025-03-02 15:00:10,762 - Ether / IP / TCP 192.168.88.192:51585 > 157.240.235.19:https A
2025-03-02 15:00:10,762 - Ether / IP / TCP 157.240.235.19:https > 192.168.88.192:51585 PA / Raw
2025-03-02 15:00:10,763 - Ether / IP / TCP 192.168.88.192:51585 > 157.240.235.19:https A
2025-03-02 15:00:10,763 - Ether / IP / TCP 157.240.235.19:https > 192.168.88.192:51585 PA / Raw
2025-03-02 15:00:10,764 - Ether / IP / TCP 192.168.88.192:51585 > 157.240.235.19:https PA / Raw
2025-03-02 15:00:10,772 - Ether / IP / TCP 157.240.235.19:https > 192.168.88.192:51585 A / Padding
2025-03-02 15:00:10,799 - Ether / IP / TCP 157.240.235.19:https > 192.168.88.192:51585 PA / Raw
2025-03-02 15:00:10,842 - Ether / IP / TCP 192.168.88.192:51585 > 157.240.235.19:https A
2025-03-02 15:00:10,927 - Ether / IP / TCP 157.240.235.19:https > 192.168.88.192:51585 PA / Raw
2025-03-02 15:00:10,936 - Ether / IP / TCP 157.240.235.19:https > 192.168.88.192:51585 PA / Raw
2025-03-02 15:00:10,937 - Ether / IP / TCP 192.168.88.192:51585 > 157.240.235.19:https A
2025-03-02 15:00:10,938 - Ether / IP / TCP 192.168.88.192:51585 > 157.240.235.19:https PA / Raw
2025-03-02 15:00:11,005 - Ether / IP / TCP 157.240.235.19:https > 192.168.88.192:51585 A / Padding
2025-03-02 15:00:11,185 - Ether / IP / UDP 74.125.130.95:https > 192.168.88.192:65263 / Raw
2025-03-02 15:00:11,196 - Ether / IP / UDP 192.168.88.192:65263 > 74.125.130.95:https / Raw
2025-03-02 15:00:11,295 - Ether / IP / UDP / mDNS Qry b'BRWE86F389A94E9.local.'
2025-03-02 15:00:11,297 - Ether / IP / UDP 192.168.88.139:58386 > 224.0.0.252:llmnr / LLMNRQuery who has 'BRWE86F389A94E9.'
2025-03-02 15:00:11,325 - Ether / Dot1Q / IP / UDP / mDNS Qry b'_companion-link._tcp.local.'
2025-03-02 15:00:11,344 - Ether / IP / UDP / mDNS Qry b'BRWE86F389A94E9.local.'
2025-03-02 15:00:11,345 - Ether / IP / UDP 192.168.88.139:56208 > 224.0.0.252:llmnr / LLMNRQuery who has 'BRWE86F389A94E9.'
2025-03-02 15:00:11,584 - Ether / IP / TCP 192.168.88.192:50278 > 192.168.88.149:8009 PA / Raw
2025-03-02 15:00:11,598 - Ether / IP / UDP / DNS Qry b'time.cloudflare.com.'
2025-03-02 15:00:11,630 - Ether / IP / UDP / DNS Qry b'time.cloudflare.com.'
2025-03-02 15:00:11,639 - Ether / IP / UDP / DNS Ans 162.159.200.123
2025-03-02 15:00:11,640 - Ether / IP / UDP / NTP v4, client
2025-03-02 15:00:11,661 - Ether / IP / UDP / DNS Ans 162.159.200.1
2025-03-02 15:00:11,671 - Ether / IP / UDP / NTP v4, server
2025-03-02 15:00:11,684 - Ether / IP / TCP 192.168.88.149:8009 > 192.168.88.192:50278 PA / Raw
2025-03-02 15:00:11,712 - Ether / IP / UDP 192.168.88.139:58386 > 224.0.0.252:llmnr / LLMNRQuery who has 'BRWE86F389A94E9.'
2025-03-02 15:00:11,737 - Ether / IP / TCP 192.168.88.192:50278 > 192.168.88.149:8009 A
2025-03-02 15:00:11,757 - Ether / IP / UDP 192.168.88.139:56208 > 224.0.0.252:llmnr / LLMNRQuery who has 'BRWE86F389A94E9.'
2025-03-02 15:00:12,029 - Ether / ARP who has 192.168.88.134 says 192.168.88.134 / Padding
2025-03-02 15:00:12,301 - Ether / IP / UDP / mDNS Qry b'BRWE86F389A94E9.local.'
2025-03-02 15:00:12,348 - Ether / IP / UDP / mDNS Qry b'BRWE86F389A94E9.local.'
2025-03-02 15:00:12,600 - Ether / IP / UDP 192.168.88.87:45483 > 239.255.255.250:ssdp / Raw
2025-03-02 15:00:12,643 - Ether / ARP who has 192.168.88.14 says 192.168.88.14 / Padding
2025-03-02 15:00:12,645 - Ether / ARP who has 192.168.88.14 says 192.168.88.14 / Padding
2025-03-02 15:00:12,645 - Ether / ARP who has 192.168.88.14 says 192.168.88.14 / Padding
2025-03-02 15:00:12,794 - Ether / IP / UDP 192.168.88.192:49185 > 64.233.170.94:https / Raw
2025-03-02 15:00:12,795 - Ether / IP / UDP 192.168.88.192:49185 > 64.233.170.94:https / Raw
2025-03-02 15:00:12,796 - Ether / IP / UDP 192.168.88.192:49185 > 64.233.170.94:https / Raw
2025-03-02 15:00:12,796 - Ether / IP / UDP 192.168.88.192:49185 > 64.233.170.94:https / Raw
2025-03-02 15:00:12,826 - Ether / IP / UDP 64.233.170.94:https > 192.168.88.192:49185 / Raw
2025-03-02 15:00:12,827 - Ether / IP / UDP 64.233.170.94:https > 192.168.88.192:49185 / Raw
2025-03-02 15:00:12,828 - Ether / IP / UDP 64.233.170.94:https > 192.168.88.192:49185 / Raw
2025-03-02 15:00:12,829 - Ether / IP / UDP 64.233.170.94:https > 192.168.88.192:49185 / Raw
2025-03-02 15:00:12,830 - Ether / IP / UDP 64.233.170.94:https > 192.168.88.192:49185 / Raw
2025-03-02 15:00:12,831 - Ether / IP / UDP 192.168.88.192:49185 > 64.233.170.94:https / Raw
2025-03-02 15:00:12,832 - Ether / IP / UDP 64.233.170.94:https > 192.168.88.192:49185 / Raw
2025-03-02 15:00:12,833 - Ether / IP / UDP 192.168.88.192:49185 > 64.233.170.94:https / Raw
2025-03-02 15:00:12,833 - Ether / IP / UDP 64.233.170.94:https > 192.168.88.192:49185 / Raw
2025-03-02 15:00:12,834 - Ether / IP / UDP 192.168.88.192:49185 > 64.233.170.94:https / Raw
2025-03-02 15:00:12,835 - Ether / IP / UDP 64.233.170.94:https > 192.168.88.192:49185 / Raw
2025-03-02 15:00:12,861 - Ether / IP / UDP 64.233.170.94:https > 192.168.88.192:49185 / Raw
2025-03-02 15:00:12,862 - Ether / IP / UDP 64.233.170.94:https > 192.168.88.192:49185 / Raw
2025-03-02 15:00:12,863 - Ether / IP / UDP 192.168.88.192:49185 > 64.233.170.94:https / Raw
2025-03-02 15:00:13,269 - Ether / IP / UDP 192.168.88.192:55724 > 172.253.118.95:https / Raw
2025-03-02 15:00:13,305 - Ether / IP / UDP 172.253.118.95:https > 192.168.88.192:55724 / Raw
2025-03-02 15:00:13,371 - Ether / IP / TCP 104.22.37.195:https > 192.168.88.192:50237 PA / Raw
2025-03-02 15:00:13,372 - Ether / IP / TCP 192.168.88.192:50237 > 104.22.37.195:https PA / Raw
2025-03-02 15:00:13,373 - Ether / IP / TCP 104.22.37.195:https > 192.168.88.192:50237 PA / Raw
2025-03-02 15:00:13,374 - Ether / IP / TCP 192.168.88.192:50237 > 104.22.37.195:https PA / Raw
2025-03-02 15:00:13,379 - Ether / IP / TCP 192.168.88.192:50237 > 104.22.37.195:https PA / Raw
2025-03-02 15:00:13,410 - Ether / IP / TCP 104.22.37.195:https > 192.168.88.192:50237 A / Padding
2025-03-02 15:00:13,411 - Ether / IP / TCP 104.22.37.195:https > 192.168.88.192:50237 A / Padding
2025-03-02 15:00:13,417 - Ether / IP / TCP 104.22.37.195:https > 192.168.88.192:50237 A / Padding
2025-03-02 15:00:13,589 - Ether / IP / TCP 192.168.88.192:50404 > 204.79.197.239:https PA / Raw
2025-03-02 15:00:13,589 - Ether / IP / TCP 192.168.88.192:50404 > 204.79.197.239:https PA / Raw
2025-03-02 15:00:13,590 - Ether / IP / TCP 192.168.88.192:50404 > 204.79.197.239:https PA / Raw
2025-03-02 15:00:13,619 - Ether / IP / UDP / mDNS Qry b'BRWE86F389A94E9.local.'
2025-03-02 15:00:13,620 - Ether / IP / UDP 192.168.88.139:49407 > 224.0.0.252:llmnr / LLMNRQuery who has 'BRWE86F389A94E9.'
2025-03-02 15:00:13,626 - Ether / IP / TCP 204.79.197.239:https > 192.168.88.192:50404 A / Padding
2025-03-02 15:00:13,627 - Ether / IP / TCP 204.79.197.239:https > 192.168.88.192:50404 PA / Raw
2025-03-02 15:00:13,627 - Ether / IP / TCP 204.79.197.239:https > 192.168.88.192:50404 A / Padding
2025-03-02 15:00:13,681 - Ether / IP / TCP 192.168.88.192:50404 > 204.79.197.239:https A
2025-03-02 15:00:13,685 - Ether / IP / UDP / mDNS Qry b'BRWE86F389A94E9.local.'
2025-03-02 15:00:13,687 - Ether / IP / UDP 192.168.88.139:53707 > 224.0.0.252:llmnr / LLMNRQuery who has 'BRWE86F389A94E9.'
2025-03-02 15:00:13,789 - Ether / IP / TCP 192.168.88.192:51451 > 125.234.51.74:https A / Raw
2025-03-02 15:00:13,795 - Ether / IP / TCP 125.234.51.74:https > 192.168.88.192:51451 A
2025-03-02 15:00:13,945 - Ether / IP / TCP 204.79.197.239:https > 192.168.88.192:50404 PA / Raw
2025-03-02 15:00:13,946 - Ether / IP / TCP 204.79.197.239:https > 192.168.88.192:50404 PA / Raw
2025-03-02 15:00:13,946 - Ether / IP / TCP 192.168.88.192:50404 > 204.79.197.239:https A
2025-03-02 15:00:13,947 - Ether / IP / TCP 204.79.197.239:https > 192.168.88.192:50404 PA / Raw
2025-03-02 15:00:13,948 - Ether / IP / TCP 192.168.88.192:50404 > 204.79.197.239:https PA / Raw
2025-03-02 15:00:13,974 - Ether / ARP who has 192.168.88.142 says 192.168.88.142 / Padding
2025-03-02 15:00:13,984 - Ether / IP / TCP 204.79.197.239:https > 192.168.88.192:50404 A / Padding
2025-03-02 15:00:14,037 - Ether / IP / UDP 192.168.88.139:49407 > 224.0.0.252:llmnr / LLMNRQuery who has 'BRWE86F389A94E9.'
2025-03-02 15:00:14,099 - Ether / IP / UDP 192.168.88.139:53707 > 224.0.0.252:llmnr / LLMNRQuery who has 'BRWE86F389A94E9.'
2025-03-02 15:00:14,338 - Ether / IP / UDP / mDNS Ans b'Android-6.local.'
2025-03-02 15:00:14,483 - Ether / Dot1Q / IP / UDP / mDNS Qry b'lb._dns-sd._udp.local.'
2025-03-02 15:00:14,625 - Ether / IP / UDP / mDNS Qry b'BRWE86F389A94E9.local.'
2025-03-02 15:00:14,686 - Ether / IP / UDP / mDNS Qry b'BRWE86F389A94E9.local.'
2025-03-02 15:00:14,796 - Ether / IP / TCP 192.168.88.192:50244 > 157.240.235.15:https PA / Raw
2025-03-02 15:00:14,797 - Ether / IP / TCP 192.168.88.192:50247 > 157.240.235.15:https PA / Raw
2025-03-02 15:00:14,828 - Ether / IP / TCP 157.240.235.15:https > 192.168.88.192:50244 A / Padding
2025-03-02 15:00:14,831 - Ether / IP / TCP 157.240.235.15:https > 192.168.88.192:50247 A / Padding
2025-03-02 15:00:14,980 - Ether / IP / TCP 157.240.235.15:https > 192.168.88.192:50244 PA / Raw
2025-03-02 15:00:14,985 - Ether / IP / TCP 157.240.235.15:https > 192.168.88.192:50247 PA / Raw
2025-03-02 15:00:15,026 - Ether / IP / TCP 192.168.88.192:50244 > 157.240.235.15:https A
2025-03-02 15:00:15,027 - Ether / IP / TCP 192.168.88.192:50247 > 157.240.235.15:https A
